SENTENCE	LABEL
Concordo con tutti coloro che affermano la necessità di più organizzazioni regionali e condivido anche il parere del collega e di chi afferma che la Commissione deve svolgere un ruolo adeguato al loro interno.	1
I funzionari di più alto rango devono assicurare che il merito sia giustamente retribuito e che tutti i posti vacanti, anche quelli di più alto rango, siano pubblicati dalla Gazzetta ufficiale e su Internet.	1
Condividiamo il parere di chi ha presentato la relazione che ha posto notevole enfasi sull'informazione in relazione ai rischi e sulla trasparenza, in particolare nel campo sanitario e della sicurezza.	0
Ciò significa, nel concreto, assumere altri ispettori, oltreché ampliare le competenze e i campi di controllo, soprattutto per quanto concerne il rispetto e la divulgazione delle norme sociali e in materia di condizioni di vita e di lavoro degli equipaggi.	1
Credo anche che si dia troppa importanza alla valutazione di figure specialistiche, professionisti della tossicologia e dell'economia.	0
È vero, come ha detto qualche oratore, che serve uno sforzo di informazione sulla Carta, il quale può iniziare in questo stesso Parlamento.	1
Sto semplicemente cercando di spiegare un problema di funzionamento comune, sul quale ho peraltro già scritto alla persona a capo della Presidenza, Nicole Fontaine, che è d'accordo con me.	0
Presidente, desidero ringraziare in modo particolare l'onorevole Van Lancker e la Presidenza francese per l'eccellente cooperazione instaurata a tutt'oggi.	0
Per concludere vorrei ringraziare per la preziosa collaborazione gli altri membri della commissione per l'occupazione e gli affari sociali, le persone di altre commissioni che hanno presentato le loro relazioni, il Comitato economico e sociale e il Comitato delle regioni, le ONG impegnate in ambito sociale ed il personale tecnico che ha collaborato con me in rappresentanza della Commissione, della Presidenza francese e del Parlamento.	0
Visto che l'esponente della Commissione Patten ha molta esperienza, per non dire abilità, nel gestire le crisi internazionali, sarebbe opportuno che, dopo le sue numerose visite nelle varie zone dei Balcani, si recasse anche presso la sede dell'Agenzia a Salonicco, per vedere come opera.	0
Nonostante tutta la simpatia per la persona a cui è stato conferita questa delega, onorevole Theato, e per i suoi contributi in altri casi molto validi, non approviamo l'istituzione di una tale autorità, poiché tale figura si situa nel quadro di quell'Europa federale alla quale ci opponiamo.	0
Signor Presidente, anche io voglio ringraziare l'onorevole Haug per l'ottimo lavoro di preparazione del bilancio.	1
Nessun individuo bosniaco ha partecipato ai negoziati di pace con cui è stata posta fine alla guerra in Bosnia. Questo sebbene il mondo fosse al corrente degli stupri sistematici cui tale categoria di persone era stata sottoposta e delle responsabilità verso la ricostituzione di una società di cui avrebbero dovuto farsi carico.	0
In molti casi, obbligare le Istituzioni a diffondere queste note interne potrebbe indurre una certa confusione nella cittadinanza.	0
Secondo la correlatrice, onorevole Duff, si tratterebbe di un passo avanti enorme per migliorare la qualità dell'integrazione europea.	1
Vorrei informare che l'insegnante in questione ha inventato tutto e ha confessato che non vi è stata aggressione alcuna ma che le sue ferite sono state autoinflitte.	0
La rappresentante, onorevole Gill, è riuscita a conciliare opinioni diverse in modo equilibrato, con un importante contributo da parte della onorevole Fraisse e della commissione per la cultura.	1
Alcuni membri di un gruppo marxista-leninista hanno cercato di creare scompiglio durante la riunione e hanno minacciato la persona a capo della presidenza.	0
Come può vedere, tutti i membri della Camera, quasi senza eccezioni, hanno la vocazione di membri della Commissione e vogliono spiegarci i problemi.	0
Signor Presidente, innanzitutto mi congratulo con il rappresentante, onorevole Sudre.	1
Ogni abitante del mondo ha lo stesso diritto di produrre emissioni di CO2; non è giusto che la popolazione americana possa produrne 200 volte di più che quella africana.	0
Desidero congratularmi con l'onorevole rappresentante Liese, per la sua relazione e aggiungo un ringraziamento per il suo sforzo di conciliazione fra le varie posizioni.	0
Se noi che viviamo in Europa riusciremo in tal senso avremo un'Accademia di polizia di cui poterci vantare.	0
Infine ringrazio sentitamente la nostra abile capodelegazione, la onorevole Méndez de Vigo.	1
Signor Presidente, vorrei ringraziare il Commissario per la sua risposta.	1
La consideriamo un ulteriore sviluppo sulla base del lavoro dell'onorevole collega Mombaur, nel sostenere la produzione da tali fonti di una maggiore quota di elettricità e di energia nell'Unione europea.	0
Desidero ringraziare il nostro portavoce, onorevole De Roo, per il lavoro svolto.	1
Come l'onorevole collega Doyle del Fine Gael, so bene che ciò non equivale alla creazione di un esercito europeo, e prima che nel mio paese inizino proteste (come probabilmente accadrà) contro il coinvolgimento dell'Irlanda, vorrei affrettarmi a sottolineare che la partecipazione è volontaria e sarà decisa caso per caso.	0
Ha facoltà l'onorevole Varela, la presidente della commissione per la pesca, per esprimere il parere di detta commissione.	1
Non è corretto, invece, rinviare una votazione perché i colleghi non possono essere presenti la sera.	1
E, comunque sia, è ovvio che la cittadinanza debba esserne pienamente informata.	0
Chi opera in ogni fase della catena produttiva avrà l'obbligo di introdurre sistemi e pratiche atte a garantire che gli alimenti ed i mangimi che producono siano sicuri.	0
A quanto ci risulta, il numero dei prigionieri politici è recentemente passato da 1500 a 3000 e molti di essi sono stati mandati ai lavori forzati e subiscono crudeli torture.	1
Per questa ragione, credo che con la risoluzione che ci accingiamo a votare domani noi conferiremo alle nostre due rappresentanti Brok e Tsatsos, un mandato molto chiaro: presentare a Nizza una proposta in tal senso.	1
Di conseguenza molti viaggiatori e vacanzieri trarranno beneficio da questa iniziativa europea.	1
In molti casi, obbligare le Istituzioni a diffondere queste note interne potrebbe indurre una certa confusione tra i cittadini.	1
Credo che dobbiamo intanto ringraziarlo per aver seguito il dibattito, giacché non era prevista la sua presenza anche durante questa discussione.	1
Sono convinto che anche questa base giuridica non regga affatto, ed è pertanto giusto che i sindacati, le aziende, i colleghi puntino il dito sulle perdite occupazionali.	1
Devo dissentire dalla collega, l'onorevole Poos.	1
Concordo pertanto con il relatore, onorevole de Roo, quando propone di non perdere altro tempo e di trasformare questa direttiva sulla valutazione e la gestione del rumore in una direttiva quadro vincolante.	1
La onorevole Ana de Palacio Vallelersundi ha una sorella, la quale è una Comissaria della Commissione europea.	1
Il governatore ha dimostrato che da lui non ci possiamo aspettare di più.	1
Signor Presidente, mi associo alle congratulazioni generali all'onorevole Gonzáles Álvarez, che è stato un portavoce comprensivo ed esauriente.	1
Desidero ringraziare il membro della Commissione per la sua osservazione sulla base giuridica.	0
L'unica artista che siamo stati in grado di rintracciare e che avrebbe tratto beneficio dalla proposta ha detto che non era interessata dal momento che la procedura sarebbe stata troppo complessa per aiutare lei o la sua famiglia.	1
Più tardi, quando il nostro collega, l'onorevole Doyle, ha sollevato la questione, il Presidente stesso ha improvvisamente deciso di inserirla nell'ordine del giorno.	1
Vorrei elogiare il lavoro svolto dal deputato, l'onorevole Haug, nel cercare di portare a soluzione alcune questioni particolarmente difficili quest'anno, date le enormi pressioni esercitate sul bilancio in una fase molto avanzata della procedura.	1
Il secondo è il caso di uno studente greco, Mikis Mantakas, ucciso circa 25 anni fa a Roma a seguito di un attentato terroristico delle Brigate rosse.	1
A nostro avviso è un buon documento che per noi dei partiti cristiano-democratici rispecchia le nostre norme e i nostri valori.	0
Sono anche felice di vedere onorevoli liberali liberali dell'Europa continentale, cui ci lega un rapporto di amicizia, indicare la strada a chi ha una posizione liberale in Gran Bretagna.	0
A mio parere, infatti, non avremo esaurito il tema della sicurezza marittima finché non avremo parlato dei marinai.	1
So quanto Gayssot, a capo del Ministero, presti attenzione all'azione di Equasis ed ora anche al futuro Galileo, che dobbiamo implementare.	0
Signor Presidente, anche il nostro gruppo appoggia il rappresentante, e lo ringrazia per il buon lavoro svolto.	1
Presidente, con la relazione sulle regioni ultraperiferiche, l'onorevole portavoce Sudre ha compiuto un ottimo lavoro.	0
Questo è quanto chiedono oggi sia i vertici politici sia le popolazioni locali.	0
Oltre ad adottare tre importanti documenti, i leader che hanno preso parte al vertice sono stati impegnati attivamente nel discutere questioni delicate quali i diritti dell'uomo, il mare della Cina meridionale, Timor Est e la Birmania.	1
Sono io stesso l'autore di questa formulazione, con l'emendamento n. 72 adottato in commissione per gli affari esteri, i diritti dell'uomo, la sicurezza comune e la politica di difesa il 10 ottobre 2000.	1
Affinché i cittadini si sentano coinvolti nell'Unione europea, nelle sue politiche e Istituzioni, è compito in particolare dei parlamentari di far conoscere maggiormente le scelte cruciali, le contraddizioni, le differenze d'interessi e di progetti che muovono gli attori economici e sociali sulla scena europea.	1
Mi rivolgo in particolare alla Commissaria Verheugen, responsabile in materia di ampliamento.	1
Gentile Presidente, mi unisco all'onorevole Patrie nel ringraziare calorosamente l'onorevole Liese, membro della delegazione, per i numerosi sforzi dedicati alla ricerca di un consenso.	0
Fu Ministro della Sanità quando il signor Barón Crespo era Presidente.	1
Con grande proprietà di linguaggio, lei ha denunciato violazioni della dignità della donna e ha reclamato sanzioni, volte ad indurre un cambiamento.	1
Il Presidente del Consiglio dei ministri di Gibilterra, Peter Caruana, ci ha saggiamente chiesto di riferire direttamente a lui.	1
Vorrei ancora osservare e far rilevare che in questo settore anche chi fa impresa dovrebbe godere di particolare sostegno e chiedo al Parlamento di sollecitare la Commissione ad accompagnare i progressi in questo ambito attraverso un processo di benchmarking e di score-board.	0
I pensionati e gli anziani sono coloro che, più di altri, sono vittime degli atti della delinquenza: certo, non della grande delinquenza che porta al riciclaggio di denaro sporco, che noi combattiamo, ma di quei piccoli atti di criminalità che ne derivano e che rendono così difficile la vita di tutti, in particolare degli anziani.	1
Signor Presidente, vorrei sottolineare quanto ha appena affermato il mio collega, l'onorevole Hernández Mollar.	1
Condivido le preoccupazioni e i criteri espressi questo pomeriggio dal portavoce Rühle in relazione ai capitoli della ricerca e degli aiuti sociali.	1
Vorrei informare che la stessa professoressa si è inventata tutto e ha confessato che non vi è stata aggressione alcuna ma si è picchiata da sola.	1
Anche se qualche passaporto viene restituito, anche se il Presidente Ben Ali ha pronunciato, in occasione dell'anniversario della sua salita al potere, un discorso sulla libertà di stampa e sul miglioramento delle condizioni detentive, constatiamo un grave deterioramento della situazione dei diritti umani in Tunisia.	1
E noi stessi, i politici europei, non abbiamo sufficiente chiarezza sul processo negoziale.	1
Le figure leader anno altresì confermato l'impegno a preparare volontariamente delle relazioni annuali che diano conto degli sforzi compiuti al fine di superare le barriere al commercio individuate nel relativo piano d'azione.	0
In ogni modo, tutte le traduzioni saranno a disposizione di ogni onorevole in tempo per la votazione.	0
Forse dovremmo anche pensare alle vittime ed ai numerosi soggetti legati con vincolo di parentela alle persone morte del morbo di Creutzfeldt-Jacob.	0
L'ONU dev'essere fiera di annoverare nelle sue fila una candidatura come quella di Lubbers; è mia convinzione che sicuramente si distinguerà al servizio dell'ACNUR e di tutte le Nazioni Unite.	0
Abbiamo sentito la persona che ha tenuto il discorso. Ora ci occorrono una persona che parla a favore e una a sfavore.	0
Signora Presidente, anzitutto mi congratulo con la relatrice generale, la onorevole Haug, per l'eccellente lavoro svolto.	1
Se ciò non dovesse avvenire, i cittadini dei nostri paesi non ne capirebbero il perché.	1
Questa relazione è stata menzionata dalla Presidente Chirac nella sua allocuzione al Parlamento, alcune settimane fa.	1
Abbiamo poi trattato anche la questione delle minoranze, poiché l'importanza della loro integrazione, anche linguistica, è notevole nei rispettivi paesi.	0
Siamo sconfitti noi politici, perché abbiamo lanciato un pessimo segnale a tante persone profondamente impegnate: non siamo riusciti a raggiungere un accordo.	1
Si è già recata in visita a Sarejevo, ha partecipato a una riunione regionale informale a Skopje e si è anche recata a Mosca.	1
Grazie all'iniziativa del presidente della commissione per le petizioni, onorevole Gemelli, è stata intrapresa la corretta azione giuridica necessaria per emendare la decisione del Parlamento europeo del 1994.	1
Non dimentichiamo che si deve all'onorevole Whitehead, laburista come me, l'introduzione di emendamenti che prevedono una deroga per i negozi caritatevoli, e dovremmo congratularci per il risultato che ha raggiunto.	0
Si tenga presente che, nella sua replica, chi svolge la funzione di mediazione in Europa ha detto specificamente che risponderà alle denunce ricevute entro questo mese.	0
Le mie congratulazioni all'onorevole Ferber, con cui ci rapportiamo più direttamente per le relazioni sulle altre Istituzioni.	0
Mi permetta comunque di dire che la Commissaria Fischler non è mediterranea né tantomeno atlantica e, inoltre, che abbiamo la disgrazia di avere una Direttrice generale della pesca che proviene dall'Atlantico settentrionale e che è venuta a conoscenza dei problemi della pesca nel momento in cui è stata nominata per questo incarico.	1
I relatori dei vari paesi vengono spesso rimproverati di essere diventati ambasciatori non retribuiti del paese candidato di cui sono responsabili, di essere accecati dall'amore.	1
Ritengo opportuno che, a nome del Parlamento europeo, faccia pervenire a Laurent Gbagbo, che ha vinto le elezioni, un messaggio di solidarietà e appoggio.	0
Le regole più severe richieste dal relatore nel suo documento, tra l'altro per pervenire alla compilazione di un elenco esaustivo di prodotti, come lo stesso relatore chiede alla Commissione di fare, rappresentano una proposta interessante che porterà ad un rafforzamento di questa politica.	1
Per i suddetti motivi gli europarlamentari del partito greco KKE votano contro la relazione.	1
Nell'interesse dell'ambiente, ma anche di chi svolge attività di pesca, dobbiamo mirare ad assicurare uno sfruttamento sostenibile delle risorse della pesca.	0
Tutte le persone afghane, di qualunque età, sono vittime di violazioni sistematiche dei loro diritti più fondamentali.	0
Ha nuovamente facoltà la onorevole Varela, la presidente della commissione per la pesca, commissione competente sul merito.	1
Le donne non possono esercitare la loro professione, le ragazze non possono andare a scuola, le donne non si possono muovere liberamente per strada, vengono lapidate, tanto per citare alcuni esempi.	1
Come ricordato dalla relatrice nel suo documento, a tutt'oggi sono stati registrati scarsi progressi a livello dei lavori volti a sostituire l'odierna regolamentazione transitoria in materia di IVA con una regolamentazione definitiva basata sulla tassazione nel paese d'origine.	1
Ancora due parole su un aspetto sollevato da alcune persone intervenute durante la discussione: la questione della Georgia e dei visti.	0
Vorrei ringraziare il delegato, onorevole Almeida Garrett, per il suo contributo a questo lavoro così importante.	1
Sono molto grato al Commissario Verheugen per il chiarimento apportato sulla questione della chiusura delle centrali nucleari.	1
Le figure politiche di quella parte di Europa che dopo la seconda guerra mondiale ha goduto di un destino più felice, e ciò vale in particolare per l'Austria, dovrebbero dunque dimostrarsi avvedute e moderate nel criticare quei paesi.	0
Mi congratulo con l'onorevole Marinho, socialista come noi, per l'eccellente relazione sul rafforzamento della lotta contro il riciclaggio di denaro e la criminalità organizzata internazionali.	0
Le Istituzioni europee hanno potere e quindi dobbiamo circoscrivere tale potere al servizio dei cittadini.	1
Come è accaduto a Mehdi Zougah, con cittadinanza franco-tunisina, che la polizia ha arrestato all'aeroporto di Tunisi l '11 agosto scorso.	0
Gentile Presidente, l'altra sera a Bari, capoluogo della regione Puglia, una delle più importanti regioni italiane, Raffaele Fitto, presidente della regione nonché collega qui al Parlamento europeo fino al giugno di quest'anno, ha subito un'aggressione e un pestaggio.	0
In secondo luogo, la presidente delle poste francesi, signora Claude Bourmaud, ha recentemente spiegato che il prossimo decennio sarà foriero della più profonda trasformazione mai verificatasi per i servizi postali in tutto il mondo.	1
È doveroso sottolineare l'impegno profuso da Haug nel suo ruolo di referente generale nella ricerca di un consenso intelligente, che mi auguro non venga meno.	0
Chiediamo che la persona accusata dimostri di non aver commesso discriminazioni e che fornisca prove documentali.	0
Signora Presidente, mi consenta innanzitutto di esprimere un caloroso apprezzamento alla relatrice per il suo documento, che offre una panoramica eccellente, coerente e di ampio respiro della situazione.	1
Non vorrei succedesse, col principio di precauzione, quello che è successo a un mio amico, che è uscito di casa con la famiglia e si è ritrovato al centro di uno scandalo.	1
Ha facoltà l'onorevole Varela, il presidente della commissione per la pesca, per esprimere il parere di detta commissione.	1
Signor Presidente, vorrei innanzitutto congratularmi con il collega Elisabeth Montfort per l'ottima relazione relativa al programma pluriennale per le imprese e l'imprenditorialità per il periodo 2000-2005.	1
Le donne polacche ci sono state assai grate per aver sottolineato che il resoconto non ha rispecchiato la loro posizione.	1
Solo il Presidente belga, Verhofstadt, è stato un'eccezione positiva.	1
Lo scorso 3 ottobre, rivolgendosi al Parlamento, la Presidenza, nella figura di Prodi ha fatto riferimento al triangolo istituzionale e ha rilevato che in un sistema europeo fondato su controlli ed equilibri la fluidità del funzionamento di ciascuna Istituzione contribuisce all'interesse comune.	0
Decine di migliaia di persone imprigionate per motivi politici sono state rilasciate.	0
Quasi un milione di persone spagnole, di tutte le fedi politiche, è insorto per protestare contro questo delitto deprecabile.	0
Se i controlli non vengono effettuati e se non vi sono possibilità di controllare chi svolge i controlli, l'intenzione di garantire la sicurezza della cittadinanza viene minata alla base.	0
Approfittando della presenza del Commissario Bolkestein, responsabile del mercato interno, vorrei ricordare che vari anni fa il Parlamento europeo avviò la sua prima inchiesta proprio per occuparsi della frode nel transito delle merci.	1
Solo la Presidente belga, Verhofstadt, è stata un'eccezione positiva.	1
Nessuno si assume chiaramente la responsabilità se c'è più di un decisore.	1
Vorrei che il Commissario confermasse che ringrazierà le ONG attive sul campo.	1
Signor Presidente, sebbene il portavoce affermi con modestia che la relazione avrebbe potuto essere migliore, vorrei complimentarmi con lui.	1
Allocuzione pronunciata da, Vojislav Kostunica, Presidente della Repubblica federale di Jugoslavia	0
Ma una persona tra quelle a capo delle amministrazioni comunali presenti alla riunione ha sollevato specificamente la questione dell'ambiente e dei rischi arrecati alla salute nell'ultimo anno: si tratta di problemi che dovremo esaminare perché rappresentano un serio pericolo per la salute nell'Europa sudorientale.	0
La Commissaria Monti stessa ha svolto un lavoro eccellente l'anno scorso.	1
Concordo con chiunque affermi la necessità di più organizzazioni regionali e condivido anche il parere dell'onorevole collega e di chi afferma che la Commissione deve svolgere un ruolo adeguato al loro interno.	0
Pertanto mi rammarica vedere che il partito Conservatore britannico si sia schierato contro l'idea secondo cui le Istituzioni dell'Unione sono tenute a rispondere delle violazioni ai diritti della cittadinanza dell'Unione.	0
Vorrei chiedere al Commissario se può confermare che ringrazierà la Commissione a Bruxelles e, in particolare, Michael Graham, il capodelegazione stesso, che durante tutto questo periodo ha assistito a cambiamenti enormi e ha svolto un lavoro indefesso per promuovere il processo verso la democrazia.	1
Ieri sera la mia collega, onorevole Solbes, ha comunicato al Parlamento che la Commissione può accettare gli emendamenti nn. 1, 2, 3, 4, 6, 7, 13 e 14.	1
Vorrei ribadire quanto detto dalla Presidenza poco fa.	0
Signora Presidente, mi congratulo con la delegata per il suo eccellente lavoro volto ad individuare le cause e le dimensioni della povertà, termine appropriato per una realtà sociale la cui durezza non si può attenuare in un concetto ampio e, al tempo stesso, astratto come quello di esclusione sociale.	1
Signora Presidente, l'altra sera a Bari, capoluogo della regione Puglia, una delle più importanti regioni italiane, è stata aggredita e malmenata la presidente della regione, Raffaele Fitto, che è stata nostra collega qui al Parlamento europeo fino al giugno di quest'anno.	1
Desidero ringraziare la delegata per il suo contributo costruttivo e per la sua disponibilità a recepire i pareri espressi dalle altre commissioni.	1
Sentire negare da parte sua il calo degli aiuti di Stato nel periodo 1994-1998, mentre la stessa Commissione lo riconosce, è come minimo curioso.	0
Esemplificativo è il caso della promozione di una figura funzionaria distrettuale, la cui collera ha provocato la fuga di centinaia di persone cristiane.	0
Abbiamo da poco incontrato il Presidente Prodi, il quale ci ha confermato il suo personale impegno a dare attuazione al Libro bianco, conformemente alle molte raccomandazioni che, anno dopo anno, sono pervenute dall'Istituzione che tanto degnamente il signor Karlsson presiede.	1
Mi è stato affidato il compito di fungere da relatore per l'Estonia.	1
Peraltro, tengo ad appoggiare il rappresentante allorché precisa che bisogna adoperarsi affinché il diritto di disporre di un sistema di filtraggio ad un prezzo accessibile sia garantito.	1
A nostro avviso è un buon documento che per noi cristiano-democratici rispecchia le nostre norme e i nostri valori.	1
Gli individui hanno l'obbligo di accettare il lavoro temporaneo, sono maggiormente esposti agli impieghi precari e alla disoccupazione e percepiscono in media retribuzioni inferiori del 30 per cento.	0
Gentile Presidente, vorrei iniziare congratulandomi con l'onorevole Skinner, responsabile della relazione, per l'eccellente lavoro svolto nella stesura di questa relazione.	0
Non abbiamo votato contro per le buone intenzioni espresse dall'autore.	1
Signor Presidente, desidero infine ringraziare il deputato per il valido contributo fornito all'esame di questo tema.	1
Molti membri l'hanno già detto stamattina e io mi associo pienamente alle loro parole.	0
La persona incaricata di riferire in merito si è soffermata nella sua relazione sulle possibilità dei paesi candidati di rientrare nell'ambito delle raccomandazioni concernenti la mobilità.	0
Forse dovremmo anche pensare alle vittime ed ai numerosi familiari delle persone morte del morbo di Creutzfeldt-Jacob.	1
Signora Presidente, ringrazio la Commissaria per la risposta e desidero porre un'interrogazione complementare.	1
In realtà, l'irrealista è la persona a capo della Presidenza, se pensa che con un Trattato così sarà possibile ampliare l'Unione.	0
Ritengo che la Commissaria debba mostrare al settore in questione che lei sta facendo quanto è in suo potere in tale ambito per affrontare questa minaccia alla nostra industria navale.	1
Il mio collega, l'onorevole Bösch ha già esposto gli emendamenti proposti per questa relazione.	1
In secondo luogo, il presidente delle poste francesi, signor Claude Bourmaud, ha recentemente spiegato che il prossimo decennio sarà foriero della più profonda trasformazione mai verificatasi per i servizi postali in tutto il mondo.	1
Va apprezzato lo sforzo compiuto dalla relatrice Haug allo scopo di integrare tutti i suggerimenti da noi avanzati a tale riguardo.	1
Mi rivolgo personalmente a Verheugen, membro della Commissione, con alcuni commenti, ma desidero anzitutto garantire che noi non abbiamo mai dubitato che Verheugen voglia l'ampliamento, e che le critiche contro il suo operato erano in parte mosse dalla malafede.	0
Un numero troppo elevato di persone che vivono nel Paese è colpito dall'emarginazione.	0
