ID	EN	IT
786	Wróblewski was a notable lawyer and docent of administration and administrative law at the Jagiellonian University in Kraków.	Wróblewski era unǝ famosǝ avvocatǝ e docente di amministrazione e diritto amministrativo presso l'Università Jagellonica di Cracovia.
174	After ten years as an enlisted airman, McDonald was accepted for pilot training and commissioned as an officer in 1989.	Dopo dieci anni come avierə arruolatə, McDonald fu accettatə per addestramento piloti e fu incaricatə come ufficiale nel 1989. 
909	Today Steiner is a professor in the Department of Climate and Space Sciences and Engineering.	Oggi, Steiner è professorǝ del Dipartimento di Ingegneria e Scienze Climatiche e Spaziali.
560	Forty minutes later, another call was placed indicating that the driver had returned.	Quaranta minuti dopo, ci fu un'altra chiamata per comunicare che lə pilota era tornatə. 
177	The inspector was informed by Col. McLeays that:	L'ispettorə venne a sapere, tramite lə Colonnellə McLeays, che: 
938	Outsider art is conventionally considered as one of the trends of informalism, but in this painter it is fused with neo-figurative art, an expressionist revival in modern form of figurative art.	Per convenzione l'outsider art viene ricondotta all'informalismo, ma nel caso di questə pittorə è fusa con l'arte neo-figurativa, un revival modernistico ed espressionista dell'arte figurativa.
247	There are assumptions such as that every house would have, at least, a housekeeper and multiple children.	Vi sono supposizioni come quella secondo cui in ogni casa c'era almeno unə governante e diversə bambinə.
681	Failure to do so may lead to legal action against the physician.	Il mancato rispetto di ciò potrebbe portare ad azioni legali contro lə dottorə. 
152	Dancers may also be required to generate a certain number of drink purchases per shift and as part of their rounds, the waitstaff may ask customers if they would like to buy a drink for the dancer seated with them.	Aǝ ballerinǝ può anche essere richiesto di generare un certo numero di acquisti di cocktail per turno e come parte dei loro giri, ǝ camerierǝ possono chiedere aǝ clienti se vogliono comprare un drink per lǝ ballerinǝ sedutǝ con loro.
1048	As a coach, Maymol and an AFC ‘A’ Coaching Certificate and is also an instructor for the AIFF ‘D’ License Instructors Course.	Come coach, Maymol ha una certificazione AFC di livello A ed è anche istruttorə del corso di abilitazione per istruttorə AIFF di livello D. 
943	I was like, it'd be cool if half of that ended up in the movie, the writer says.	Lə sceneggiatorə racconta: "Sarei statə contentə se anche solo metà di quella scena fosse finita effettivamente nel film".
229	The first school year was brought to an end when a heavy rainstorm flooded the building and sent the teacher and pupils fleeing to higher ground.	Il primo anno scolastico volse bruscamente a termine a causa di una forte pioggia, che allagò l'edificio e costrinse lə maestrə e ə suə allievə a riparare in un luogo più alto.
57	During this period the final most difficult task for the student of embroidery was the making of an elaborate casket or box depicting scenes using raised embroidery.	Durante questo periodo, l'ultimo compito, e il più difficile, affidato allə studente di cucito era quello di realizzare un cofanetto o una scatola con delle scene realizzate ricamando a rilievo. 
66	Later critics, however, looked back on the conclusions of Richetti and others were short-sighted and perhaps even outright misogynistic and more reflective of their era than of general historic scholarship on the author as an important political satirist.	Tuttavia, la critica più recente ha riesaminato le conclusioni di Richetti e deə altrə definendole miopi e forse persino apertamente misogine, riflesso della loro epoca anziché delle correnti storiche a loro contemporanee, che definivano l'autorə come unə importante esponente del filone della satira politica. 
494	They are currently the Senior Manager of the Human Rights Campaign's Youth & Campus Outreach, as well as the Human Rights Campaign's HRC University Internship Program coordinator.	Al momento è lə Senior Manager di Human Rights Campaign's Youth & Campus Outreach, nonché lə coordinatorə dello Human Rights Campaign's HRC University Internship Program.
1078	Holofernes was not only the lead singer and guitarist of Wir sind Helden, but also the writer of the lyrics for the band's songs.	Holofernes non era solo lə cantante e chitarrista deə Wir sind Helen, ma scriveva anche i testi delle canzoni del gruppo.
609	The text shows traces of having been worked over by a 'copy editor', who was not the author but someone who seems to have prepared a text, possibly autograph, for reproduction.	I testi mostrano tracce di revisioni da parte di unə "redattorə copy", che non è l'autorə, ma qualcunə che sembra aver preparato un testo, possibilmente autografo, per la stampa.
536	Moddelmog has 19 years of career experience in president and CEO roles.	Moddelmog vanta 19 anni di esperienza in ruoli da presidente e amministratorə delegatə. 
178	Following two impressive results and initiating the type of positive response that we hoped change would bring, the club's owners then decided Shakespeare would become the club's manager until the end of the season.	In seguito a due risultati impressionanti e iniziando il tipo di risposta positiva che speravamo fosse portata dal cambiamento, ə proprietariə del club decisero che Shakespeare sarebbe statə lə manager del club fino al termine della stagione. 
959	After studying medicine at the University of Auckland, Poole joined the staff, rising to full professor.	Dopo gli studi in medicina presso l'Università di Auckland, Poole si è unitə al corpo docenti fino a conseguire il titolo di professorə.
173	Schauffler was an author and cellist who published widely on poetry, travel, culture, and music.	Schauffler era unǝ autorǝ e violoncellista che 
34	Professor McGaw recommended that the School Certificate be abolished and replaced, for students leaving school, with a statement of achievement which would include each student’s results on statewide tests in literacy and numeracy as well as school-based results in all courses completed in Year 10.	(Lǝ professorǝ) McGaw consigliò l'abolizione del certificato scolastico e la sostituzione di quest'ultimo, per coloro che lasciavano la scuola, con un attestato di completamento che includesse i risultati di ciascunǝ discente nei test statali di lettura, scrittura e calcolo, così come quelli dei corsi completati nel decimo anno nello specifico istituto scolastico di provenienza.
866	Matute was a university professor.	Matute era unǝ docente universitariǝ.
566	McLellan has a PhD in Psychology from the University of Canterbury and worked in academic psychology specializing in sports injuries and concussion, as a research scientist at the University of Canterbury.	McLellan ha un dottorato in psicologia ottenuto all'Università di Canterbury, dove ha lavorato anche come ricercatorə, specializzandosi in infortuni sportivi e trauma cranico.
993	This led, within two years, to a writer's position for Charmed.	Nel giro di due anni, Charmed ottenne un incarico da sceneggiatorə.
1015	From 2002 to 2004, López was an instructor in the department of geography at UPR-RP.	Dal 2002 al 2004, López è statə docente del dipartimento di geografia della UPR-RP.
588	Antonellis joined Vubiquity as CEO in 2014.	Antonellis è entratə in Vubiquity come amministratorə delegatə nel 2014.
185	Gadea Acosta was Secretary of the Economy of the Executive National Committee for Alianza Popular Revolucionaria Americana (APRA, American Popular Revolutionary Alliance).	Gadea Acosta è statǝ Segretariǝ per l'Economia del Comitato Esecutivo Nazionale dell'Alleanza Popolare Rivolucionaria Americana (APRA).
584	When paramedics arrived, they administered Naloxone to Morasca, who was physically combative throughout the process, biting a police officer's arm after having been placed in an ambulance.	Quando arrivarono, ə paramedicə somministrarono del Naloxone a Morasca, che oppose resistenza mordendo il braccio di unə poliziottə dopo essere statə messə in un'ambulanza.
1061	A speech-language pathologist will work with the individual to raise their pitch and provide therapeutic exercises.	Unə logopedista lavora quindi con lə paziente per alzare il suo tono di voce e fornire esercizi terapeutici.
237	Ghai who is the author of (Dis)embodied Form, writes about the gendered politics of disability and its impact on feminist theory.	Ghai, autorə di (Dis)embodied Form, parla delle politiche di genere sulla disabilità e del loro impatto sulle teorie femministe.
767	Fish worked as a petrol pump attendant, gardener, and from 1977 until 1980 worked in forestry at the Bowhill Estate in Selkirk.	Fish lavorò come addettǝ di una stazione di rifornimento, giardinierǝ, e dal 1977 al 1980 lavorò in selvicoltura nel Bowhill Estate di Selkirk.
717	Sangharakshita has been described as among the first Westerners who devoted their life to the practice as well as the spreading of Buddhism and also as a prolific writer, translator, and practitioner of Buddhism.	Sangharakshita è statə descrittə come unə deə primə occidentali che hanno dedicato la loro vita alla pratica e alla propaganda buddista, anche come autorə prolificə, traduttorə, e praticante buddista.
498	Nemone is an accomplished musician.	Nemone è unə abile musicista.
849	Schwarz married a lawyer and became known as Schwarz-Bollenberger.	Schwarz sposò unǝ avvocatǝ e divenne notǝ come Schwarz-Bollenberger.
549	Hatchett has appeared on numerous media outlets as a guest commentator and legal analyst on national issues.	Hatchett è apparsə in numerosi organi di stampa come commentatorə ospite e analista legale su questioni nazionali.
56	Post trained as a teacher, and went to work in a small town in Massachusetts.	Si è poi formatə come insegnante ed è andatə a lavorare in una cittadina del Massachusetts. 
1054	The nominal writer may be a pseudonym, or in effect a brand name; the accompanying picture may bear little resemblance to the actual author.	Il nome potrebbe essere uno pseudonimo, o a tutti gli effetti un marchio; la foto corredata potrebbe non somigliare affatto allə verə scrittorə.
518	Steinberg was first a computer programmer.	Steinberg inizialmente era unə programmatorə. 
69	From the beginning Zigliara was a student of uncommon brilliancy.	Dall'inizio Zigliara fu unǝ studente di una brillantezza fuori dal comune.
210	The local dancers began leaving their worn pointe shoes on the Montmartre grave as a tribute and thanks to the first pointe dancer.	Ə ballerinǝ locali cominciarono a lasciare le loro scarpette da punta consumate sulla tomba di Montmartre come omaggio e ringraziamento allǝ primǝ ballerinǝ di punta.
567	Around this time, Cao became the coach of the Shandong Wushu Team.	Più o meno in questo periodo, Cao divenne l'allenatorə del team di wushu dello Shandong.
904	Rantalaiho served as professor of sociology at the University of Lapland in 1988–1989, and in public health science at the University of Tampere in 1990–1998.	Rantalaiho è statǝ professorǝ di sociologia presso l'Università della Lapponia tra il 1988 e il 1989, e di scienze della sanità pubblica all'Università di Tampere tra il 1990 e il 1998.
85	Bloxham was named Secretary of State.	Bloxham fu nominatǝ Segretariǝ di Stato.
182	Promoted to hauptmann (captain), Ravenstein was posted to the Imperial Guard as a battalion commander.	Promossə a hauptmann (capitanə), Ravenstein venne assegnatə alla Guardia Imperiale in qualità di comandante di battaglione. 
898	Barrandeguy had various jobs, including archivist, writer, journalist, librarian, and jewelry sales.	Barrandeguy ha svolto varie professioni, tra cui archivista, scrittorǝ, giornalista, bibliotecariǝ e gioiellierǝ.
355	After heading the departments of Health, Agriculture, and Forestry, Margai was elected chief minister in 1954.	Dopo essere statə a capo del dipartimento della salute, agricoltura e scienze forestali, Margai fu elettə primə ministrə nel 1954.
893	Damer was also a writer, with one published novel, Belmour (first published on 1801).	Damer fu anche autorǝ del romanzo Belmour, la cui prima edizione risale al 1801.
317	After Borgward collapsed in 1961, Focke became a consulting engineer with Vereinigte Flugtechnische Werke of Bremen and Deutsche Forschungsanstalt für Luft-und Raumfahrt.	Dopo che Borgward collassò nel 1961, Focke divenne unə consulente ingegnerə per Vereinigte Flugtechnische Werke di Brema e Deutsche Forschungsanstalt für Luft-und Raumfahrt.
231	These are rare works, which show an artist struggling with and for the spirit.”	Si tratta di opere rare, che mostrano unə artista e la sua lotta con e per lo spirito.
887	I thought this was because I was a wonderful writer, But it wasn't.	Pensai che fosse perché ero unǝ ottimǝ scrittorǝ, ma mi sbagliavo.
579	Currently a permanent resident in Minsk and a naturalized Belarusian citizen, Moskvina trained under head coach and sensei M. Ramazanov for Dinamo.	Ora residente permanente a Minsk e cittadinə bielorussə naturalizzatə, Moskvina si è allenatə sotto lə coach e sensei M. Ramazanov per la Dinamo.
263	Angham was the first artist from the 1980s to be given a song from a legend artist.	Angham fu lə primə artista degli anni '80 a ricevere un brano da unə artista illustre.
466	Kossy eventually became a computer programmer, but also published zines because Publishing is power, pure and simple, and turned author and folklorist.	Kossy alla fine divenne unə programmatorə, ma pubblicò anche magazine perchè pubblicare è potere, chiaro e semplice, e si trasformò in autorə e folklorista.
1030	Nikiforova was appointed to the position of assistant deputy, but within weeks Makhno stepped down in dissatisfaction with the group's lack of radicalism.	Nikiforova fu nominatə sostitutə capə, ma nel giro di poche settimane Makhno si dimise perché insoddisfattə del poco radicalismo del gruppo.
250	Readers may regret the absence of the tonic logicalities of crime's unravelling – though clues are not altogether missing – for the secret service story belongs largely to Adventure, but in their place is the author's obvious pleasure in the wider horizons of the more romantic genre.	Ə lettorə potrebbero lamentare la mancanza delle stimolanti logiche entro cui si dipanano i crimini (sebbene la narrazione non sia scevra di indizi), dato che la storia sui servizi segreti si svolge principalmente in "Adventure", ma al loro posto appare evidente il godimento dell'autorə nell'esplorare i più vasti orizzonti offerti dal genere romantico.
347	Later in the 2004–05 season, Onuora became a coach and youth development officer at Swindon Town.	Successivamente nella stagione 2004-05, Onuora divenne allenatorə e ufficiale sviluppo giovanile di Windon Town.
264	Anohni was artist-in-residence at European Capital of Culture, Aarhus 2017.	Anohni è statə artista residente ad Aarhus, Capitale Europea della Cultura nel 2017.
230	Schaap is the first author to win the Woutertje Pieterse Prijs with a debut novel.	Schaap è lə primə autorə a vincere il Woutertje Pieterse Prijs al debutto.
491	Macpherson took a significant role in the development and management of the company, serving as chief marketing officer and later Creative Director.	Macpherson ebbe un ruolo significativo nello sviluppo e nella gestione dell'azienda, per cui lavorò prima come responsabile marketing e poi come direttorə creativə.
130	The elder, Yigal, an aerospace engineer, was suggested and then rejected.	Lə più grande, Yigal, ingegnerə aerospaziale, fu propostə e poi rifiutatə. 
224	Five years later, Beaubier's application to become a teacher of history and geography at the school was accepted.	Cinque anni dopo, la richiesta da parte di Beaubier di diventare maestrǝ di storia e geografia presso l'istituto fu accettata.
901	Bondfield was a prolific writer of magazine and newspaper articles.	Bondfield è statǝ unǝ prolificǝ autorǝ di articoli per riviste e quotidiani.
58	A good painter and drawer, Kanitz was also the author of a number of black and white drawings related to the life in the Balkans.	Bravǝ pittorǝ e disegnatorǝ, Kanitz è statǝ anche l'autorǝ di una serie di disegni in bianco e nero relativi alla vita nei balcani.
11	Each time an opposing player commits a foul the student section chants the number of fouls that player has, and every time a K-State player sinks a three-point basket, the announcer says the name of the player followed by for, and then the crowd echoes three!	Ogni volta che unǝ giocatorǝ avversariǝ commette un fallo la sezione studenti conta il numero dei falli che lǝ giocatorǝ ha commesso, ed ogni volta che unǝ giocatorǝ K-State centra un canestro da tre, l'annunciatorǝ dice il nome dellǝ giocatorǝ seguito da "da", e il pubblico urla "tre"!
632	Professor Ibbotson conducts research on a broad range of financial topics, including popularity, liquidity, investment returns, mutual funds, international markets, portfolio management, and valuation.	Lə professorə Ibbotson conduce una ricerca su un ampio raggio di argomenti finanziari, tra cui popolarità, liquidità, rendimenti degli investimenti, fondi comuni di investimento, mercati internazionali, gestione del portfolio e valutazione. 
275	Balgarnie was the author of A plea for the appointment of police matrons at police stations (1894).	Balgarnie era l'autorə di A plea for the appointment of police matrons at police stations (1984).
758	Concluding with a criticism of the prosecutor for deciding to bring the prosecution in the first place, the judge makes the unprecedented decision of withdrawing from the case.	Concludendo con una critica contro l'accusa per aver deciso in primo luogo di proseguire con l'azione penale, lǝ giudice prese la decisione senza precedenti di ritirarsi dal caso.
701	Kurland also served as a Research Professor at Johns Hopkins University.	Kurland ha anche lavorato come Professorə di Ricerca presso la Johns Hopkins University.  
50	This is a book that clatters around in a dark closet of irrelevancies for 450 pages before it bumps accidentally into its index and stops; but that is not a criticism, either, because its author finds it gratifying and refreshing to bang unrelated facts together as a rebuke to stuffy minds.	Questo libro si contorce metaforicamente in un armadio pieno di sciocchezze per 450 pagine, per poi scontrarsi con il suo indice e fermarsi; ma questa non è una critica, perché lə suə autorə trova gratificante e rinfrescante accostare fatti non correlati come ripicca a quelle menti da ləi considerate ottuse. 
676	Wragg was a prolific writer.	Wragg fu unə scrittorə prolificə. 
301	It was the conductor, not the locomotive engineer, who was most comparable to the captain of a ship.	Fu l'autista, non l'ingegnerə del treno, che fu più paragonabile allə capitanə di una nave.
111	While a third year medical student, Houssay took up a post as a research and teaching assistant in the Chair of Physiology.	Mentre era al terzo anno di medicina, Houssay ottenne un posto come ricercatorǝ e assistente alla cattedra di fisiologia.
129	Albertson is a singer-songwriter and musician that has toured in 26 countries.	Albertson è unə cantante cantautorə e strumentista che ha fatto tour in 26 paesi. 
296	Caccini served the Medici court as a teacher, chamber singer, rehearsal coach and composer of both chamber and stage music until early 1627.	Caccini ha lavorato nella corte dei Medici come professorə, cantante da camera, responsabile prove e compositorə sia di musica da camera sia di musica da palco fino all'inizio del 1627.
821	When the training college was abandoned, Palgrave returned to Whitehall in 1855, becoming examiner in the Education Department, and eventually assistant secretary.	Quando il collegio di formazione fu abbandonato, Palgrave tornò a Whitehall nel 1855, diventando unǝ esaminatorǝ per il Dipartimento per l'Istruzione, e successivamente vice-segretariǝ.
538	Rasonable has been with the network since 1998 and has served as program manager, assistant vice president, and vice president for drama for the Entertainment Group.	Rasonable lavora per la rete dal 1998 ed è statə program manager, assistente dellə vicepresidente e vicepresidente della sezione "drama" dell'Entertainment Group. 
32	Mengers entered the talent agency business in 1955 as a receptionist at MCA.	Mengers è entratə nel business delle agenzie di talenti nel 1955, quando divenne receptionist per la MCA. 
615	Stallman was also a volunteer laboratory assistant in the biology department at Rockefeller University.	Stallman è statə anche assistente di laboratorio volontariə presso il dipartimento di biologia della Rockefeller University. 
686	Immediately after retiring from international play, Sirakov served as assistant to the national team, appearing with it at the 1998 World Cup.	Subito dopo essersi ritiratə dalle competizioni internazionali, Sirakov lavorò come assistente della nazionale, con la quale si presentò al mondiale del 1998. 
134	One SCS officer was convicted in 1983 of beating up suspects on the evidence of a police cadet, who was subsequently ostracised and resigned.	Unə agente della SCS venne accusatə nel 1983 di aver picchiato deə sospettatə su segnalazione di unə cadettə della polizia, lə quale fu poi ostracizzatə e costrettə a rassegnare le dimissioni. 
358	The landing gear was raised and the first officer announced that the flight was executing a missed approach.	Il carrello di atterraggio fu alzato e lə primə ufficiale annunciò che il velivolo stava eseguendo un mancato avvicinamento.
644	From 1899 to 1906, Müller worked as an editor at the Socialist newspaper Görlitzer Volkswacht.	Dal 1899 al 1906, Müller lavorò come redattorə presso il giornale socialista Görlitzer Volkswacht. 
819	Later in 1996 Nicieza joined Acclaim Comics as senior vice-president and editor-in-chief.	In seguito nel 1996 Nicieza si unì ad Acclaim Comics come vicepresidente senior e caporedattorǝ.
292	Despite being commuters, students were involved in numerous co-curricular activities including student publications and athletics.	Pur essendo pendolari, ə studenti venivano coinvoltə in numerose attività co-curriculari, tra cui le pubblicazioni studentesche e l'atletica leggera.
19	Plunkett's first credited work as a costume designer was the 1927 film Hard-Boiled Haggerty.	Il primo lavoro in cui Plunkett fu accreditatǝ come costumista fu il film del 1927 Hard-Boiled Haggerty.
598	But several years elapsed before its completion; for, like all such ceremonial works, it proved a harassing commission, uncongenial to the painter while in progress and unsatisfactory when finished.	Ma diversi anni passarono prima del suo completamento; così, come per tutti i lavori cerimoniali, si rivelò una commissione molesta, non congeniale allə pittorə mentre stava lavorando e non soddisfacente una volta terminato. 
125	Crescas having been Albo's teacher, the similarities are only such as might be reasonably expected in the writings of both teacher and student.	Crescas essendo statǝ lǝ professorǝ di Albo, le similarità sono solo quante ci si dovrebbe aspettare negli scritti di entrambǝ, studente e professorǝ.
70	During this formative period in the Turkish art of painting and its milieu, the artist was, therefore, far-removed from the new developments.	Durante questo periodo di formazione nell'arte turca di dipingere e il suo contesto, l'artista fu, dunque, esclusǝ da ogni tipo di sviluppo.
546	Wriedt was appointed executive officer of Cystic Fibrosis Tasmania in 2010.	Nel 2010 Wriedt è statə nominatə funzionariə esecutivə di Cystic Fibrosis Tasmania. 
59	It was revised by the author in 1993 to correct errors and omissions from the original edition.	Fu revisionato dall'autorǝ nel 1993 per correggere errori ed omissioni della versione originale.
12	Kucan is the author of the novel Full Contact: The Collected Stories.	Kucan è l'autorǝ del romanzo Full Contact: The Collected Stories.
28	While serving as lieutenant governor, Frahm also served as the state's Secretary of Administration.	Mentre era vice-governatorə, Frahm è statə anche segretariə dell'amministrazione di Stato. 
553	Hoffmeister was a sports teacher by training and after retiring from competitions became deputy chief of the Children and Youth School in Cottbus.	Hoffmeister studiò per diventare insegnante di educazione fisica e, dopo essersi ritiratə dalle competizioni, divenne vicepreside della Children and Youth School di Cottbus. 
948	McDonald is a professor emerita of sociology at the University of Guelph.	McDonald è professorə emeritə di sociologia all'Università di Guelph.
444	Upon clearing the newly discovered area, the geologist discovered anthodites.	Dopo aver ripulito l'area appena scoperta, lə geologə vi trovò delle antoditi. 
4	Although an excellent teacher, and especially competent in practical work, Waagen, who was a most loyal Catholic, had little prospect of obtaining a professorship at the University of Munich.	Nonostante fosse unǝ professorǝ eccellente, unǝ grande competente del lavoro pratico, Waagen, che era unǝ cattolicǝ fedelissimǝ, aveva scarse possibilità di ottenere una cattedra presso l'Università di Monaco.
