ID	EN	IT
75	From 1989 to 1997, Nair was Singapore's Deputy Secretary at the Ministry of Defence.	Dal 1989 al 1997, Nair fu vice segretariǝ presso il ministero della difesa di Singapore.
920	Ferszt is a professor of nursing and the coordinator of the graduate psychiatric mental health clinical nurse specialist program at URI.	Ferszt è docente di infermieristica e coordinatorǝ del programma di specializzazione in infermieristica clinica psichiatrica dell'Università del Rhode Island.
631	For a brief time McCuddy was also a writer for Saturday Night Live.	Per un breve periodo McCuddy fu anche scrittorə per Saturday Night Live. 
705	Tradition dictates the winner of the decathlon holds the title of World's Greatest Athlete.	Secondo la tradizione, lə vincitorə del decathlon detiene il titolo di Miglior atleta del mondo.  
352	Heiji Hattori was inspired by the fictional Inspector Hattori, from Shunsaku Kudo stories.	Heiji Hattori fu ispiratə dall'ispettorə fittiziə Hattori, dalle storie di Shunsaku Kudo.
176	Terangpi is a competitive motorcyclist, long distance rider and photographer.	Terangpi è unǝ motociclista agonisticǝ e di lunga distanza, nonché fotografǝ.
25	Placing such an order with a potter and vase painter is likely to be unique in antiquity and is evidence of the high reputation of this artist.	Commissionare qualcosa di simile a unǝ vasaiǝ e ceramografǝ era probabilmente qualcosa di unico nell'antichità e testimonia la grande reputazione di cui godeva questǝ artista.
1021	Maddow was a competitive athlete and participated in high school volleyball, basketball, and swimming.	Maddow era unə atleta agonista e faceva parte delle squadre di pallavolo, basket e nuoto del suo liceo.
390	Jeppe is a poor farmer who drinks too much.	Jeppe è unə poverə contadinə che beve troppo. 
606	During the 2-year period between 1506-1508 Achillini was a Professor at the University of Padua.	Durante i due anni tra il 1506 e il 1508 Achillini fu professorə all'Università di Padova. 
654	McWhiney became a noted specialist on the American Civil War era, as well as southern social and economic history.	McWhiney divenne unə conosciutə specialista sul periodo della guerra civile americana, e anche sulla storia sociale ed economica del sud. 
969	Unprepared lawyers suffered the consequences, but the vigorous questioning was an aid to lawyers seeking to tailor their arguments to the judge's concerns.	Ə avvocatə più impreparatə ne subirono le conseguenze, ma il vigoroso interrogatorio aiutò ə legali che miravano ad aggiustare i propri interventi sulla base delle preoccupazioni dellə giudice.
360	After holding the post, Leung became an honorary advisor for the local governments of Shenzhen, Tianjian and Shanghai on land reform.	Dopo aver mantenuto la posizione, Leung divenne consulente onorariə per i governi locali di Shenzhen, Tianjian e Shanghai sulle riforme fondiarie.
384	Moszkowski then travelled successfully throughout Europe with the reputation of being an exceptional concert pianist and brilliant composer, having also gained some recognition as a conductor.	Moszkowski ha viaggiato con successo attraverso l'Europa con la reputazione di pianista eccezionale e brillante compositorə, avendo anche ottenuto alcuni riconoscimento come direttorə d'orchestra.
778	The writer considered simple but important problems of birth and death, suicide and suffering.	Lǝ scrittorǝ considerò problemi della nascita e della morte, allo stesso modo come suicidio e sofferenza, semplici ma importanti.
1001	Takata was a commentator and judge on the show.	Takata era unə deə commentatorə e giudici dello show.
687	All does not go as planned and the chemist soon becomes entangled in a web of deceit.	Tutto non va secondo i piani e lə chimicə rimane presto intrappolatə in una rete di truffe. 
942	Thrupp is particularly remembered as a writer of hymns for children.	Thrupp è ricordato in particolare come scrittorə di inni per bambinə.
219	Chronologically, the book follows immediately after the author's Downbelow Station and is one of Cherryh's series of Merchanter novels.	Cronologicamente, il libro segue immediatamente Downbelow Station dell'autorǝ ed è una delle serie di romanzi Merchanter di Cherryh.
1090	From 2011 to 2013, Weiss was senior news and politics editor at Tablet.	Dal 2011 al 2013, Weiss fu redattorə senior delle sezioni Notizie e Politica di Tablet. 
431	Alcock was made deputy inspector-general of hospitals.	Alcock divenne vice ispettorə generale degli ospedali. 
1040	Beers is an associate professor in the department of history at American University College of Arts and Sciences.	Beers è professorə associatə del dipartimento di Storia dell'American University College of Arts and Sciences.
253	It was their intention to teach without the use of authoritarian rules or a unilateral flow of power from teacher to student.	Il loro obiettivo era insegnare senza servirsi di dogmi autoritari o di un flusso unilaterale di potere da professorə a studente.
572	Sotherton is a performance coach and specialises in running.	Sotherton è unə performance coach ed è specializzatə nella corsa.
718	McCullough also was a professor at Oregon State University.	McCullough era anche professorə alla Oregon State University.
635	Gopalam is an assistant public prosecutor.	Gopalam è unə assistente pubblicə ministerə. 
255	Neshat was artist in residence at the Wexner Center for the Arts (2000) and at MASS MoCA (2001).	Neshat è statə artista residente presso il Wexner Center for the Arts (2000) e il MASS MoCA (2001).
338	Vovos is a rally driver and was president of Maroussi Basketball Club.	Vovos è unə pilota di rally ed è statə presidente del Maroussi Basketball Club.
26	As a result, Shapinsky became a 'revived artist' as an abstract impressionist.	Come risultato, Shapinsky divenne unǝ "artista rinatǝ" come impressionista astrattǝ.
719	Kornheiser later described the Bandwagon columns as the most fun I ever had as a writer.	Kornheiser successivamente descrisse le colonne per Bandwagon come il periodo in cui si è più divertitə come scrittorə.
335	Yorimitsu served as commander of a regiment of the Imperial Guard, and as a secretary in the Ministry of War.	Yorimitsu lavorò come comandante di un reggimento di guardie imperiali, e come segretariə del ministero per la guerra.
319	Ronsard was the acknowledged chief of the Pléiade and its most voluminous poet.	Ronsard fu universalmente riconosciutə come capə della Pléiade, di cui fu lə poeta più prolissə.
899	The rhythm, the feeling, the style and phraseology of L. E. L.'s poetry, were such, that you could immediately recognize it, though the writer's name was not mentioned.	Il ritmo, il sentimento, lo stile e la fraseologia della poesia di L. E. L. erano tali da renderla immediatamente riconoscibile, anche senza sapere il nome dellǝ scrittorǝ.
870	Hamidullah founded a monthly magazine called the Mirror, and became its editor and publisher in 1952.	Hamidullah ha fondato un mensile chiamato The Mirror, di cui è diventatǝ redattorǝ ed editorǝ nel 1952.
268	Marlatt is currently a student of the Gelug school of Tibetan Buddhism, and currently lives in Vancouver, B.C.	Al momento, Marlatt è unə allievə della scuola Gelug di buddhismo tibetano e vive a Vancouver, nella Columbia Britannica.
185	Although charged with the murders, and the attempted murder of the police officer, Gaggi was only convicted of assault.	Nonostante fosse accusatə degli omicidi, e del tentato omicidio dell'ufficiale di polizia, Gaggi fu condannatə solo per assalto. 
897	Masango was a painter.	Masango era unǝ pittorǝ.
123	Pawlowski was born in Warsaw in a family of a car mechanic and studied law at university there.	Pawlowski nacque a Varsavia, figliə di unə meccanicə, e studiò legge nella stessa città. 
658	Agashe served as a professor of Psychiatry at the B. J.	Agashe lavorò come professorə di psichiatria presso la B.J. 
109	Neumann is the author, publisher and translator of several books on the subject.	Neumann è l'autorǝ, editorǝ e traduttorǝ di diversi libri sull'argomento.
183	The book contains many sex scenes and Hartnett was almost immediately outed as the author.	Il libro contiene molte scene di sesso e Hartnett fu ben presto smascheratǝ quale suo autorǝ. 
1002	Klüft was an exceptional junior athlete.	Klüft fu unə eccezionale atleta juniores.
199	Jovovich further explained, I'm an artist.	Jovovich ha inoltre spiegato: "Sono unǝ artista". 
512	Graduating from the Faculty of Medicine, Mahidol University, in 1979, Pornthip became a medical officer in the Ministry of Public Health.	Laureatə alla Facoltà di Medicina, Mahidol University, nel 1979, Pornthip divenne ufficiale medicə nel Ministero della Salute Pubblica. 
662	Hamill attended night classes at the School of Visual Arts (then called the Cartoonists and Illustrators School), with the goal of becoming a painter.	Hamill frequentò le classi serali della Scuola di Arti Visive (prima chiamata Scuola per fumettistə ed illustratorə), con l'obiettivo di diventare unə pittorə. 
583	As of 2020 Guzman is the CEO and founder of Tijiko, a company centered on digital coaching.	Alla data del 2020, Guzman è amministratorə delegatə e fondatorə di Tijiko, un'azienda incentrata sul digital coaching.
669	The procedure was performed under a stereotactic frame devised by Professor Narabayashi and involved the administration 0.6-0.8ml mixture of oil-wax to destroy the lateral groups of the amygdala nucleus, localized via pneumoencephalography.	La procedura è stata eseguita tramite una struttura stereotassica ideata dallə professorə Narabayashi e ha comportato la somministrazione di 0,6-0,8ml di una miscela olio-cera per distruggere i gruppi laterali del nucleo dell'amigdala, localizzati tramite pneumoencelografia. 
610	O Choille gu Bearradh was the Saltire Society Scottish Book of the Year for 1990, and MacLean won the McVitie's Prize for Scottish Writer of the Year.	O Choille gu Bearradh fu il Saltire Society Scottish Book dell'anno nel 1990, e MacLean vinse il premio McVitie come scrittorə scozzese dell'anno.
44	A reviewer notes that The author does a beautiful job showing and developing the practical applicability of the fascinating area of finite field theory.	Un recensore nota che l'autorǝ fa un eccellente lavoro nel mostrare e sviluppare l'applicabilità pratica dell'affascinante area della teoria dei campi finiti.
1032	Sakamoto is also known as a writer of screenplays and essays on visual art.	Sakamoto è conosciutə anche come autorə di sceneggiature e saggi sull'arte visiva.
39	Although still weak from surgery, Glaspell worked with Cook and friends to start an experimental theatre company, a creative collective.	Sebbene ancora debilitatə dall'operazione, Glaspell lavorò con Cook e altrə amicə alla creazione di una compagnia di teatro sperimentale, un collettivo creativo. 
304	Atkinson would later write, I am satisfied that no other officer of the expedition could have done better.	Atkinson scrisse successivamente: "Sono soddisfattə che nessunə altrə funzionariə della spedizione sia riuscitə a fare di meglio."
16	Ury had just arrived in town and had been working as a school teacher and a private tutor.	Ury era appena arrivatə in città e lavorava come insegnante scolasticə e tutor privatə. 
146	Burda assumed the role of sole shareholder and CEO of Burda Holding in 1987.	Burda ha assunto il ruolo di unicə azionista ed Amministratorə Delegatə di Burda Holding nel 1987. 
1046	A gifted athlete, Heaney also played Gaelic football, soccer, fastball and in-line hockey.	Atleta molto dotatə, Heaney giocava anche a calcio gaelico, calcio, softball e hockey in linea.
38	Nearby is also a small museum about the author.	Nelle vicinanze c'è anche un piccolo museo sull'autorǝ.
9	Mandzhukov is the author of several books devoted to the revolutionary struggles from 1895 to 1903.	Mandzhukov è autorə di diversi libri dedicati ai moti rivoluzionari occorsi tra il 1895 e il 1903. 
305	Senefelder was appointed 1809 to be the Inspector of a new Institution set up for this purpose in Bavaria called the Lithographic Institute (Lithographische Anstalt) in Munich.	Senefelder fu indicatə nel 1809 come Ispettorə di una nuova istituzione che si stava formando per questo proposito in Bavaria chiamata Lithographische Anstalt a Monaco.
208	Albers was a designer who worked primarily in textiles and, late in life, with printmaking.	Albers era unǝ designer che lavorò principalmente prima nel settore tessile, e in età avanzata in quello delle stampe.
915	Survilla has participated in more than 30 exhibitions as a painter.	Survilla ha preso parte a oltre 30 mostre come pittorǝ.
1066	During the mornings, Sánchez worked as an administrator.	Di giorno, Sánchez lavorava come amministratorə.
558	Prior to enrollment as a cosmonaut, Serova had worked as an engineer of the 2nd category for the RSC Energia, and in the Mission Control Center.	Prima di diventare cosmonauta, Serova aveva lavorato come ingegnerə di seconda categoria per RKK Energija, e per il Centro di controllo missione. 
124	Pemberton was editor-in-chief of SIGCHI Bulletin from 1993 to 1999 and of ACM Interactions from 1998 to 2004.	Pemberton è statə caporedattorə del SIGCHI Bulletin dal 1993 al 1999 e di ACM Interactions dal 1998 al 2004. 
734	After a short tenure at a lucrative position as the head clerk at the Bardhaman revenue collector's office, Kedarnath felt morally compromised as well as insecure with the position of a rent collector, settling for a less profitable but more agreeable occupation as a clerk elsewhere.	Dopo un breve mandato in una posizione lucrativa come capǝ assistente presso l'ufficio dell'esattore delle tasse Bardhaman, Kedarnath si sentì moralmente compromessǝ ed insicurǝ con la posizione di esattorǝ di affitti, accordandosi per una posizione meno lucrativa ma più convincente come assistente altrove.
223	Greggains is a former school and physical education teacher.	Greggains è unǝ ex insegnante di educazione fisica.
15	Coming back to Singapore in 1947, Zubir worked as a part-time photographer with the Utusan Melayu newspaper while composing and performing music and songs.	Tornando a Singapore nel 1947, Zubir lavorò come fotografə part-time con il giornale Utusan Melayu mentre componeva ed eseguiva musica e canzoni. 
749	The editor had followers who called themselves, Hébertists.	L'editorǝ aveva deǝ seguaci, che si definivano "Hébertistǝ".
260	The book discusses the author's view that casual occultism permeates youth culture and suggests tips for parents as well as classroom lessons.	Il libro esamina la visione dellə scrittorə, secondo cui l'occultismo occasionale è molto diffuso nella cultura giovanile, e offre suggerimenti utili sia aə genitorə che per le lezioni in classe.
318	Burgade had been the arresting officer for the crime that sent the outlaw to prison.	Burgade è statə l'agente che ha effettuato l'arresto per il crimine che ha mandato lə fuorilegge in prigione.
426	Several parties including the landowner advanced the funds and became proprietors, and Dibdin was appointed sole manager for life, to receive a quarter of the profits.	Diverse parti tra cui lə proprietariə terrierə inviarono i fondi e divennero proprietariə, e Dibdin fu indicatə come unicə manager a vita, così da ricevere un quarto dei profitti.
153	Antunes is a graduate in physical education and works as a teacher at the Universidade de Fafe in Fafe, Portugal.	Antunes è laureatǝ in educazione fisica e lavora come docente all'Università di Fafe, in Portogallo.
137	Lázaro shares some of the traits of the central figure of Encolpius, a former gladiator, though it is unlikely that the author had access to Petronius' work.	Lázaro condivide alcuni dei tratti della figura centrale di Encolpius, unǝ ex gladiatorǝ, anche se non è probabile che l'autorǝ avesse avuto accesso al lavoro di Petronius.
290	During production of the first anime adaptation, the author often visited the TMS Entertainment studio, where the voice actors requested advice about their characters.	Durante la produzione del primo adattamento anime, l'autorə visitava spesso gli studi della TMS Entertainment, dove ə doppiatorə lə chiedevano spesso consigli riguardo i vari personaggi.
636	Kiptanui emerged in 1991 as a relatively unknown athlete.	Kiptnaui brillò nel 1991 come atleta relativamente sconosciutə. 
3	Some episodes indicate that the author intended to have the character enter a journalistic career.	Alcuni episodi sembrano indicare che l'autorǝ voleva che il personaggio diventasse unǝ giornalista.
47	This book, based on original scholarship, vast knowledge of a rapidly changing global field, and the arcana of many loosely linked disciplines brings the skills and interests of its polymath author together for a supremely important purpose.	Questo libro, basato su studi originali, vaste conoscenze su un campo di respiro globale in rapida evoluzione e gli arcani di diverse discipline blandamente interconnesse, racchiude le competenze e gli interessi dellǝ suǝ ecletticǝ autorǝ per un fine superiore.
1042	Rolton enjoyed coaching children in swimming and horse riding, and decided to become a riding instructor.	A Rolton piaceva molto insegnare nuoto ed equitazione aə bambinə, così decise di diventare unə istruttorə di equitazione.
878	After a year it became an independent publication, with Knapp as editor for the first six years.	Dopo un anno diventò una pubblicazione indipendente, con Knapp come redattorǝ per i primi sei anni.
507	Iggwilv was caught off guard when Tsojcanth fought back for the first time in years.	Quando Tsojcanth reagì per la prima volta dopo anni, Iggwilv fu presə alla sprovvista.
98	CBS local news quoted the student:	CBS local news citò lǝ studente:
55	Zombo is an accomplished artist who has worked on projects like the promotional issue of the City of Heroes comic book.	Zombo è unǝ artista di successo che ha lavorato a progetti come il volume promozionale del fumetto City of Heroes.
988	For the next five years, Skocpol would serve as an Associate Professor of Sociology and Political Science, and of Social Science, Professor of Sociology and Political Science, and Director for the Center for the Study of Industrial Societies.	Nei cinque anni successivi, Skocpol fu professorə associatə di sociologia, scienze politiche e scienze sociali, professorə di sociologia e scienze politiche e direttorə del Centro per lo studio delle società industriali.
797	Grunberg is a prolific and versatile writer.	Gurnberg è unǝ scrittorǝ prolificǝ e versatile.
814	The book also includes an interview with Professor Hawking.	Il libro include anche un'intervista con lǝ Professorǝ Hawking.
521	Allsopp was reported in 2008 and 2009 to be an advisor to the Conservative Party on housing matters, but has denied this.	Nel 2008 e nel 2009 Allsopp è statə indicatə come consulente del Partito Conservatore in materia di alloggi, ma lə interessatə ha smentito tutto. 
150	Miyaji was born in Osaka Prefecture and became interested in mathematics as an elementary school student after learning of the Epimenides paradox.	Miyagi è natǝ nella prefettura di Osaka e, dopo aver appreso alle elementari il paradosso dellǝ mentitorǝ di Epimenide, si è interessatǝ alla matematica.
204	Gulland was a freelance artist whose primary work was as a genre painter and mezzotint engraver.	Gulland era unǝ artista freelance che lavorava principalmente con la pittura di genere e la mezzatinta.
364	Guidobaldo then served as a soldier in the ensuing conflict in Hungary between the Habsburg Empire and the Ottoman Empire.	Guidobaldo successivamente servì come soldatə nel conflitto che conseguì in Ungheria tra l'impero asburgico e quello ottomano.
646	The defence lawyer told the court that Q was a fantasist.	L'avvocatə difensorə disse alla corte che Q era unə visionariə.
235	Dahlbeck retired from acting in 1970 and became an author.	Dahlbeck smise di recitare nel 1970 e divenne unə scrittorə.
371	After retiring as a player, Kruk became a baseball analyst for ESPN.	Dopo essersi ritiratə come giocatorə, Kruk divenne unə analista di baseball per ESPN.
169	The chief curator was tall, with blond hair, and an angular face brightened by piercing eyes.	Lə curatorə capə era altə, biondə, e con un viso spigoloso, illuminato da occhi penetranti. 
446	Belleci worked as a stage manager, running errands and cleaning the shop, but quickly moved up the ranks.	Belleci ha lavorato come direttorə di scena, facendo commissioni e pulendo il negozio, ma velocemente è salitə di grado. 
436	The illusion was helped by the conductor in the orchestra pit who held the penultimate chord.	L'illusione era coadiuvata dallə direttorə d'orchestra, che dalla buca tenne in sospeso il penultimo accordo. 
312	Fulwood was chief media strategist for Human Rights Now!	Fulwood fu lə capə strategia media per Human Rights Now!
17	Lambton was made a Parliamentary Under-Secretary of State for Defence (RAF) in 1970.	Lambton fu resə sottosegretariə parlamentare dello stato per la difesa (RAF) nel 1970. 
261	Rivière is the author of the book Discontinuous Galerkin methods for solving elliptic and parabolic equations: theory and implementation (SIAM, 2008).	Rivière è l'autorə del volume "Discontinuous Galerkin methods for solving elliptic and parabolic equations: theory and implementation" (SIAM, 2008).
113	The photos gained praise for depicting a much cleaner and more handsome Doherty.	Le foto sono state apprezzate in quanto mostravano unǝ Doherty molto più pulitǝ e bellǝ.
996	Hindley's first job was as a junior clerk at a local electrical engineering firm.	Il primo impiego di Hindley fu come impiegatə junior presso un'azienda di ingegneria elettrica locale.
955	Dawkins was appointed a lecturer in zoology in 1977 and in 1998 was made Professor of Animal Behaviour.	Dawkins fu nominatə docente di zoologia nel 1977, e nel 1998 professorə ordinariə di comportamento animale.
141	The book took 18 months to compile and drew upon the author's knowledge and experience working in airfields and documenting their history.	La compilazione del libro richiese 18 mesi e attinse alle conoscenze e all'esperienza lavorativa dell'autorǝ nei campi d'aviazione, di cui documentò la storia.
110	It helped me, I feel, to recover as an artist.	Mi ha aiutatǝ, sento, a recuperare come artista.
180	The practice of smashing involved one student showering another with gifts: notes, chocolates, sometimes even locks of hair.	La pratica dello "smashing" prevedeva che unǝ studente riempisse un altrǝ di regali: biglietti, cioccolatini, a volte persino ciocche di capelli.
600	The sentencing judge ordered that Swango not be allowed to prepare or deliver food, or have any involvement in preparing or distributing drugs.	Lə giudice incaricatə di emettere la sentenza ordinò che Swango non fosse più autorizzatə a preparare o consegnare cibo, o ad avere qualsivoglia coinvolgimento nella preparazione o distribuzione di farmaci. 
18	Eiffe was also magically attracted by the student movement.	Eiffe era anche magicamente attrattə dal movimento studentesco. 
500	Beardsmore joined the BBC in 1977 as secretary to the Manager of Operations and later as a production assistant.	Beardsmore ha iniziato a lavorare per la BBC nel 1977 come segretariə del Manager of Operations, e successivamente come assistente di produzione.
184	Outside politics Aberconway was a talented artist and horticulturalist.	Al di fuori della politica, Aberconway era unǝ artista di talento e unǝ orticoltorǝ. 
8	Fabre was a popular teacher, physicist, chemist and botanist.	Fabre era unǝ insegnante popolare, fisicǝ, chimicǝ e botanicǝ. 
31	Anger, whose poem on the author appears at the end of the volume, was a relative or spouse.	Anger, la cui poesia dedicata all'autorə appare alla fine del volume, era unə suə parente o coniuge. 
940	Finally, the police learn that Viji is getting treated at the doctor's place and reach there.	Alla fine la polizia scopre che Viji si trova allo studio delle dottorə per essere curatə e si dirige lì.
488	Sowada served as the Democrat campaign manager for the 1988 NSW State election and the 1990 federal election.	Sowada è statə responsabile delle campagne elettorali democratriche per le elezioni statali del New South Wales nel 1988 e quelle federali nel 1990.
176	Peabody quickly climbed the ladder at Clelland's store, becoming a manager, then a full partner, and then purchasing the store outright in 1882.	Peabody scalò rapidamente i ranghi del negozio di Clelland, diventando ben presto prima manager, poi sociə, e rilevando infine il negozio nel 1882. 
603	For a short time in 1918 Böhler was in Italian war captivity and had to work as an advisory surgeon for Italian military hospitals.	Per un breve periodo nel 1918 Böhler fu prigionierə di guerra italianə e dovette lavorare come consulente chirurgə per ospedali militari italiani. 
221	A former dancer of classical ballet, jazz ballet and tap, as well as a dance instructor.	Ex ballerinǝ di danza classica, jazz e tip-tap, nonché insegnante di danza.
7	Etzioni is the author of over 30 books.	Etzioni è l'autorə di oltre 30 libri. 
517	The council handled the issue by giving Addams the position of garbage inspector of the ward on a salary of one thousand dollars per year.	Il consiglio risolse il problema affidando ad Addams il ruolo di ispettorə dei rifiuti del reparto, con uno stipendio annuale di mille dollari. 
