ID	EN	IT
153	Following a successful first season as manager Krogh was hired as manager of Næstved BK in the summer of 2014.	In seguito ad una prima stagione di successo come manager Krogh fu ingaggiatə come manager della Næstved BK nell'estate del 2014. 
257	Lösche was a student at the University of Bamberg in Bavaria.	Lösche era unə studente dell'Università di Bamberga, in Baviera.
131	A successful career was overshadowed by the fact that Zinoviev was in fact restricted to leave, although the scientist was repeatedly invited to foreign events.	Una carriera di successo fu oscurata dal fatto che Zinoviev era di fatto impossibilitatə ad andarsene, nonostante lə scienziatə fosse ripetutamente invitatə a convegni esteri. 
923	Seola is a fantasy, revealed to the writer while listening to the performance of an extraordinary musical composition.	Seola è un fantasy che ha preso forma nella mente dell'autorǝ durante l'esecuzione di una straordinaria composizione musicale.
172	Keever was a teacher for over 25 years.	Keever è statǝ unǝ insegnante per oltre 25 anni.
136	As with all accounts of the tradition prior to 1790 the author does not mention their alleged birth in 1100, or the name of Chulkhurst; these details first appeared in a broadside published in 1790.	Come con tutti i conti della tradizione prima del 1790 l'autorǝ non menziona la loro possibile nascita nel 1100, o il nome di Chulkhurst; questi dettagli sono apparsi per la prima volta in un volantino pubblicato nel 1790.
262	Korvasová is a student at Masaryk University, specialising in Political Science and European Studies.	Korvasová è unə studente dell'Università Masaryk e si sta specializzando in scienze politiche e studi europei.
1031	D'Istria was also a painter.	D'Istria è statə anche unə pittorə.
112	When Turnbull took over [in 1930, as captain and club secretary] they were indeed a bedraggled flock without a shepherd.	Quando Turnbull prese le redini nel 1930, come capitanǝ e segretariǝ di club, erano effettivamente un gregge senza pastore.
197	Igarashi was an associate professor of comparative Islamic culture at the University of Tsukuba.	Igarashi era unə professorə associatə di cultura islamica comparata presso l'università di Tsukuba. 
1093	As Minister Osterman rejected recommendations from an Assistant Deputy Minister Darwish regarding the insolvent state of Principal Group subsidiaries.	Da ministrə, Osterman rifiutò i consigli ricevuti dallə Viceministrə Darwish riguardo l'insolvenza di alcune filiali del Gruppo Principal.
492	After Jhirad left for Bombay, Albuquerque became senior medical officer at the hospital.	Dopo che Jhirad partì per Bombay, Albuquerque divenne ufficiale sanitariə senior dell'ospedale.
1075	Tilling was promoted to professor of medical statistics in 2011.	Nel 2011, Tilling è statə promossə a professorə di statistica medica.
166	Sainsbury also worked as project engineer and later as project director on the construction of the Natwest Tower which was completed in 1980.	Sainsbury lavorò anche come ingegnerə di progetto, e poi come direttorə di progetto, alla costruzione della Natwest Tower, completata nel 1980. 
967	Pious's excellent typing and shorthand in high school led to a job as a stenographer for a judge in Bridgeport.	Le eccellenti doti di scrittura e stenografia di Pious al liceo lə portarono a diventare unə stenografə per unə giudice di Bridgeport.
325	Although the facts of the case and the losses to the organic farmer were agreed between the parties, the judge did not find the GM farmer liable for the losses.	Nonostante i fatti del caso e le perdite dellə contadinə biologicə furono accordate tra le parti, lə giudice non reputò lə contadinə GM responsabile delle perdite.
232	The plane was loaded and usually departed in approximately 45 minutes, the flight nurse being responsible for all patients aboard.	L'aereo veniva caricato e di solito partiva nel giro di 45 minuti, e l'infermierə di volo era responsabile di tuttə ə pazienti a bordo.
637	The petition of opponents was satisfied (for this it was necessary to call the members of the scientific council, which took time), and Mergelyan became the youngest doctor of physical and mathematical sciences in the USSR at the age of 20 (at 21).	La petizione deə oppositorə fu accolta (per questo fu necessario chiamare i membri del comitato scientifico, il che richiese del tempo), e Mergelyan divenne lə più giovane dottorə in scienze fisiche e matematiche sovieticə con i suoi vent'anni (ventuno al termine del ricorso). 
293	As the first Secretary of Education, Hufstedler's agenda has been depicted as being focused on strengthening state and federal interrelationships, as well as educational equity.	L'agenda di Hufstedler come primə Segretariə all'Istruzione è stata descritta come dedicata al rafforzamento dei rapporti statali e federali, così come su una maggiore uguaglianza nei livelli di istruzione.
911	The assistant is not a target, and will scream if hit, as well as the screen getting covered in blood.	L'assistente non è un bersaglio, ma se colpitǝ urlerà, e lo schermo verrà ricoperto di sangue.
394	Konoye co-founded the Japan Symphonic Association in 1925, and the following year became conductor of the orchestra.	Konoye fu cofondatorə dell'Associazione Sinfonica Giapponese nel 1925, e l'anno successivo divenne direttorə dell'orchestra. 
855	It was staffed by a matron, storekeeper, clerk, four assistants to matron, a portress, gate keeper and constable and seven monitresses.	Il personale comprendeva unǝ caposala, unǝ magazzinierǝ, unǝ impiegatǝ, quattro assistenti dellǝ caposala, una guardia e sette supervisorǝ.
528	Shouse was hired as the assistant to the chief.	Shouse venne assuntə come assistente dellə capə. 
1067	Drysdale is a painter, a colourist, whose chosen canvases are ceramics.	Drysdale è unə pittorə e colorista che ha scelto di usare le ceramiche al posto delle tele.
20	As a student Liu's art education had strict limits; the constrained and academic style which students were forced to emulate has been likened by Liu to paint-by-numbers.	Come studente l'istruzione artistica di Liu aveva dei limiti severi; lo stile accademico e forzato che ə studenti erano obbligatə ad emulare era stato apprezzato da Liu in paint-by-numbers. 
46	Suzuki made a brief appearance as a dancer in the video for the song O!	Suzuki fece una breve apparizione come ballerinǝ nel video del brano O!
805	After retiring from cartooning, Momand became a portrait painter.	Dopo aver lasciato i cartoni, Momand divenne unǝ ritrattista.
129	Yard became the Society's first secretary and the editor of its magazine, The Living Wilderness.	Yard divenne lǝ primǝ segretariǝ della Society e l'editorǝ della relativa rivista, The Living Wilderness.
158	Rudman also spent some time as a supply teacher at Devizes School, a secondary school located in Devizes, Wiltshire.	Rudman è anche statǝ supplente per un periodo presso la Devizes School, un liceo di Devizes, Wiltshire.
534	HP's revenue doubled and the rate of patent filings increased due to mergers with Compaq and other companies during Fiorina's stint as CEO.	Grazie alle fusioni con Compaq e altre aziende, avvenute durante il periodo in cui Fiorina fu amministratorə delegatə, HP raddoppiò i ricavi e i depositi di brevetto aumentarono. 
522	Jentsch is employed as a soldier athlete.	Jentsch è unə atleta-soldatə. 
807	However, Professor Zoom refused to answer and escaped as Digger was confronted by the Rogues.	Comunque, lǝ professorǝ Zoom si rifiutò di rispondere e scappò appena Digger fu confrontatǝ daǝ Rogues.
670	However, Mola is considered to have been better as a painter of small pictures, especially landscapes.	Comunque, Mola è consideratə ancora migliore come pittorə di piccoli quadri, specialmente paesaggi. 
288	Currently, Gough is an engineering student at the University of Calgary.	Attualmente, Gough è unə studente di ingegneria presso l'Università di Calgary.
822	Grafström was also a writer and an etcher.	Grafström fu anche scrittorǝ ed incisorǝ.
395	After graduation Fridman worked as a metallurgical design engineer in Elektrostal Metallurgical Works, a state electrical machinery factory, from 1986 to 1988.	Dopo la laurea Fridman lavorò come ingegnerə progettista metallurgicə in Elektrostal Metallurgical Works, un'industria di macchine elettriche statale, dal 1986 al 1988. 
975	A USFHA Level One coaching education instructor, Fuchs has been the head coach of the regional USFHA summer league team for the last eight years.	Istruttorə USFHA Level One, Fuchs è capə coach della lega estiva regionale USFHA da otto anni.
692	Naumov was a professor of piano at the Moscow Tchaikovsky Conservatory and a jury member in many international competitions.	Naumov fu professorə di pianoforte presso il Conservatorio Tchaikovsky di Mosca e membro della giuria in molte competizioni internazionali.
433	The Manager as Negotiator made a number of contributions to the field of negotiation.	Lə manager in quanto negoziatorə ha apportato diversi contributi nel campo della negoziazione. 
590	Cantinières had commissions from the administrators of the regiments, and they were required to be married to a soldier of the regiment.	Ə cantinières ricevevano delle commissioni daə amministratorə dei reggimenti, e dovevano essere sposatə a unə soldatə facente parte del reggimento.
460	Tymoshenko has worked as a practicing economist and academic.	Tymoshenko ha lavorato come economista e accademicə.
8	Various sources cite different reasons for Secretary Korth's departure.	Varie fonti citano diverse motivazioni per le dimissioni dellə Segretariə Korth. 
1083	Janeway was a judge for the National Book Awards in 1955 and for the Pulitzer Prize in 1971.	Janeway fu unə giudice dei National Book Awards nel 1955 e del Premio Pulitzer nel 1971.
1084	Instead of taking up the editor position at McClure's, Tarbell began writing freelance articles for the magazine.	Anziché diventare editorə alla McClure, Tarbell iniziò a scrivere articoli per la rivista da freelance.
671	Berlitz was a writer on paranormal phenomena.	Berlitz era unə scrittorə di fenomeni paranormali. 
94	The Shulchan Aruch achieved its reputation and popularity not only against the wishes of the author, but, perhaps, through the very scholars who criticized it.	Lo Shulchan Aruch ha ottenuto la reputazione e la popolarità di cui gode non solo a discapito del volere dellǝ suǝ autorǝ, ma anche di tuttǝ ǝ studiosǝ che l'avevano criticato.
867	This process was then reversed, and the assistant released unharmed.	Il processo fu poi invertito, e l'assistente tornò sanǝ e salvǝ.
82	At the Vrije Universiteit itself, S. U. Zuidema was appointed, in part to relieve Vollenhoven of the introduction to philosophy course, which, with the growth of the student population after the War, had become quite demanding.	Nella stessa Vrije Universiteit, S. U. Zuidema fu incaricatǝ, in parte per risparmiare a Vollenhoven l'introduzione al corso di filosofia, che, con la crescita del numero di studenti dopo la guerra, era diventato piuttosto richiesto.
298	Nonetheless Nijinska must have truly excelled as a dancer.	Ciononostante, Nijinska dev'essere statə unə eccellente ballerinə.
392	The sheriff had previously told local retailers that selling the album could result in a prosecution for obscenity violations.	Lə sceriffə aveva avvisato ə rivenditorə locali che la vendita dell'album avrebbe potuto portare a conseguenze legali per violazione delle leggi sulla pubblica oscenità. 
468	Since 2005, Tamm has also been a stage manager at the Ugala.	Dal 2005, Tamm è anche direttorə artisticə del teatro Ugala.
173	Toth went to the show as the manager's friend; and when the band had an opening for a drummer, Toth auditioned for the spot.	Toth andò al concerto come amicə dellə manager, e quando la band si mise a cercare unə batterista, si candidò. 
620	Skelton, also a comedy writer, was chosen to take part in the flight.	Skelton, che era anche sceneggiatorə comicə, fu sceltə per partecipare al volo. 
340	The co-driver managed to defuse the situation by explaining that Carlsson was a factory driver for Saab and the owner would be given a new car.	Lə co-pilota riuscì a calmare le acque spiegando che Carlsson era unə pilota ufficiale Saab e che lə proprietariə avrebbe ricevuto una nuova auto.
378	This book was the first written by a scientist about a drug.	Questo è stato il primo libro su una droga scritto da unə scienziatə.
53	Giulini believes, If melodrama is the ideal unity of the trilogy of words, music, and action, it is impossible to imagine an artist in whom these three elements were more together than Callas.	Secondo Giulini, se il melodramma è la sintesi ideale del trinomio di parole, musica e azione, è impossibile immaginare unə artista che riunisse questi tre elementi meglio di Callas. 
160	Canright was an exceptionally smart student during high-school and took upper level classes, most notably in math and Chemistry.	Canright fu unǝ studente particolarmente brillante al liceo e frequentò corsi avanzati soprattutto in matematica e chimica.
283	Naumova had lived with the couple and acted as their secretary for 18 years.	Naumova aveva vissuto a stretto contatto con ə due, di cui era statə lə segretariə per 18 anni.
565	Pontzer joined the National Center for Complementary and Integrative Health (NCCIH) as a scientific review officer in 2002.	Nel 2002, Pontzer iniziò a lavorare per il National Center for Complementary and Integrative Health (NCCIH) come consulente scientificə.
731	Professor Väisälä not only designed the new optics, but also built several implementations of the design after Schmidt's publication.	Lǝ professorǝ Väisälä non ha solo progettato le nuove lenti, ma ne ha anche realizzato diverse implementazioni dopo la pubblicazione di Schmidt.
587	Hodgson also contributed papers to the Geologist, and was a member of the Botanical Exchange Club.	Hodgson ha scritto anche dei paper per il Geologist, ed è statə membro del Botanical Exchange Club.
327	Rushent progressed to senior assistant engineer, staff engineer, and eventually head engineer.	Rushent divenne assistente ingegnerə senior, ingegnerə del personale, e successivamente capə ingegnerə.
626	Chinnery was also an artist and painter.	Chinnery fu anche artista e pittorə. 
417	They are led by Inspector Lestrade, who arrests the gunman.	Sono guidatə dall'ispettorə Lestrade, che arresta la persona armata.
37	According to one student, Medvedev was a popular teacher; strict but not harsh.	Secondo unǝ studente, Medvedev era unǝ insegnante popolare; rigorosǝ ma non severǝ.
36	Gonzalès was Manet's only formal student and also modeled for several members of the Impressionist school.	Gonzalès fu l’unicə allievə ufficiale di Manet e ha anche fatto da modellə per diversə esponenti della scuola impressionista. 
934	Kauanui is Professor of American Studies and affiliate faculty in Anthropology at Wesleyan University in Connecticut.	Kauanui è professorə di studi americani e docente affiliatə di antropologia alla Wesleyan University, nel Connecticut.
29	Steinbacher is the author of several works on the Holocaust, including Musterstadt Auschwitz: Germanisierungspolitik Und Judenmord in Ostoberschlesien (2010) and Auschwitz: A History (2005).	Steinbacher è autorə di diversi lavori sull'Olocausto, tra cui Musterstadt Auschwitz: Germanisierungspolitik Und Judenmord in Ostoberschlesien (2010) e Auschwitz: A History (2005). 
430	Potter sketched the Gloucester street where the tailor's shop stood as well as cottage interiors, crockery, and furniture.	Potter fece uno schizzo di Gloucester street dove il negozio dellə sartə era in risalto allo stesso modo degli interni di una casetta, stoviglie e mobili. 
330	Krohg was the founding and editor-in-chief of the Kristiania Bohemian journal, Impressionisten from 1886 until 1890.	Krohg fu lə fondatorə e caporedattorə del giornale Kristiania Bohemian, Impressionisten dal 1886 al 1890.
22	Each movement of the canoe is celebrated by a short chapter, suitable for reading aloud to a child and decorated with black-and-white sketches and at least one full-page watercolor, all by the author.	Ogni movimento della canoa è celebrato in un breve capitolo, perfetto per leggere a voce alta ad unǝ bambinǝ e decorato con disegni in bianco e nero ed almeno una pagina intera in acquerello, tutto creato dall'autorǝ.
697	This occurs in the opening scene of the film, set in the 1830s, when Disraeli was still a writer and a famous dandy.	Ciò si verifica nella scena di apertura del film, ambientato negli anni '30 dell'Ottocento, quando Disraeli era ancora unə scrittorə e unə famosə dandy. 
447	Under this contract, the architect and the owner are under the obligation of the contract and must abide by it.	In base a tale contratto, l'architettə e lə proprietariə sono soggettə e tenutə a sottostare agli obblighi in esso contenuti. 
1008	A controversy broke out when a literary editor revealed the author as Hillers.	Scoppiò una controversia quando lə redattorə letterariə rivelò che l'autorə era Hillers.
58	The author's linguistic and scholarly abilities are open to question.	Le abilità linguistiche e accademiche dell'autorə sono abbastanza discutibili. 
206	Pletneva is the author of numerous books on Eurasian nomads, particularly the Khazars.	Pletneva è autorǝ di diversi libri suǝ nomadi eurasiaticǝ, in particolare suǝ Cazarǝ. 
212	During the Warsaw Uprising, Sendler worked as a nurse in a field hospital, where a number of Jews were hidden among other patients.	Durante la rivolta di Varsavia, Sendler lavorò come infermierǝ in un ospedale da campo, dove un numero di ebreǝ fu nascosto in in mezzo ad altrǝ pazienti.
1077	Galiyeva was forced to claim a severe knee injury, which was verified by the team physician.	Galiyeva è statə costrettə a dichiarare un serio infortunio al ginocchio, confermato dallə medicə della squadra.
193	After working for a time at the Valuation Department, Sowry was employed by Hannahs, shoe manufacturers and retailers as a retail manager.	Dopo aver lavorato per un periodo presso il dipartimento di valutazione, Sowry fu assuntə da Hannahs, produttorə di scarpe e retailer come manager del retail. 
152	The inspector visited the site and checked for vapors on some nearby streets but did not notice a serious problem.	L'ispettorə visitò il sito e controllò se vi erano vapori in qualche strada vicina, ma non notò un problema serio. 
691	Vladeck, a prominent labor lawyer, was concerned about inadequate scholarship and teaching about the history of the labor movement and saw the need for establishment of a central repository for historical documents.	Vladeck, unə prominente avvocatə del lavoro, era preoccupatə riguardo le inadeguate borse di studio e gli insegnamenti riguardo la storia del movimento operaio e vide la necessità di istituire un deposito per documenti storici.
652	Besides the Gorgon Painter the painters of the Komast Group (585–570 BC) should be mentioned.	A parte lə pittorə Gorgon ə pittorə del gruppo Komast (585-570 AC) dovrebbero essere menzionatə. 
502	Schitt-Hawse reappeared briefly in Something Rotten, when Thursday visited the CEO of the Goliath Corporation during a board meeting.	Schitt-Hawse è riapparsə brevemente in Something Rotten, quando Giovedì ha fatto visita allə CEO della Goliath Corporation durante una riunione del consiglio d'amministrazione.
294	Veiled, Djamileh enters in the dancer’s costume and, shy and nervous, makes to leave.	Copertə da un velo, Djamileh entra indossando un costume da ballerinə e, visibilmente nervosə, fa per andarsene.
215	Researchers found that the student pictured as smiling received less punishment than did the student who did not smile despite the fact that the smiling student was not seen as less guilty.	Ə ricercatorǝ scoprirono che lǝ studente sorridente riceveva punizioni meno severe rispetto a quellǝ con un'espressione seria, nonostante lǝ primǝ non venisse consideratǝ meno colpevole dellǝ secondǝ.
141	The car swerved from the inside lane to the outside, but the driver said Duggan leapt in front of the car, arms raised and mouth open.	L'auto aveva sterzato dalla corsia interna a quella esterna, ma lə guidatorə disse che Duggan era saltatə davanti all'auto con le mani alzate e la bocca aperta. 
240	(The less developed the artist and more experienced the manager, the higher the commission.)	(Meno conosciutə era l'artista e più era espertə lə manager, più alte erano le commissioni).
868	Marvingt became a world-class athlete who won numerous prizes in swimming, fencing, riflery, shooting, skiing, speed skating, luge and bobsledding.	Marvingt divenne unǝ atleta di prim'ordine e vinse diversi premi in discipline come nuoto, scherma, tiro, sci, pattinaggio di velocità, slittino e bob.
979	Holzman went from story editor to executive story editor to a creator and writer of the show.	Holzman passò da story editor a executive story editor a creator, fino a diventare autorə dello show.
1003	Pancholi was a practising lawyer in Edmonton with a focus on labour/employment and education law.	Pancholi era unə avvocatə praticante a Edmonton, dove si occupava per lo più di diritto del lavoro e all'istruzione.
703	Calatrava is also a sculptor and painter.	Calatrava è anche unə scultorə e pittorə.  
680	It was significant that the doctor was not an employee of the attending physician, but was only visiting the hospital and had responded to a Dr. Stork page, and had not asked or expected to be paid.	Fu significativo che lə dottorə non fosse unə impiegatə dellə dottorə curante, in quanto era solo in visita in ospedale e aveva risposto ad una pagina di Dott. Stork, e non aveva chiesto o si aspettava di essere pagatə. 
614	A mad professor has developed a virus that kills everyone once released.	Unə professorə mattə ha sviluppato un virus che uccide tuttə una volta rilasciato. 
27	After leaving politics, Spruyt entered a life as an independent consultant, journalist, teacher, writer and speaker.	Dopo aver lasciato la politica, Spruyt cominciò una vita come consulente indipendente, giornalista, maestrǝ, scrittorǝ ed oratorǝ.
26	A little high-backed cane chair, which gave you any idea but that of comfort, and a few books scattered about, completed the author's paraphernalia.	A completare l'atmosfera che circondava l'autorə c'era una piccola poltrona di vimini dall'ampio schienale, che sembrava tutto fuorché comoda, e alcuni volumi sparsi qua e là. 
40	Since 1997 Ogawa has been an exclusive recording artist for BIS Records.	Dal 1997 Ogawa è passatə in modo esclusivo sotto la BIS Records. 
320	Staudt had retired from the guard a year and a half prior to the dates of the memos.	Staudt si era ritiratə dalla guardia un anno e mezzo prima rispetto alle date menzionate nei rapporti.
823	After a two-year work as a lecturer in Frankfurt, Kohlrausch was appointed a professor of physics at the University of Göttingen (1866–70).	Dopo due anni di lavoro come professorǝ a Francoforte, Kohlrausch fu sceltǝ come professorǝ di fisica presso l'università di Göttingen (1866–70).
324	The curves on the exterior of the building were intended to appear random; the architect said that the randomness of the curves are designed to catch the light.	Le curve sull'esterno del palazzo erano da intendere come causali; l'architettə disse che la casualità delle curve è disegnata per catturare luce.
673	A journalist, writer and film producer.	Unə giornalista, scrittorə e produttorə cinematograficə. 
987	Dafovska is an administrator from Chepelare.	Dafovska è unə amministratorə di Chepelare.
182	Along with an ophthalmologist and a dentist, Condachi began the school medical service.	Affiancatǝ da unǝ oftalmologǝ e unǝ dentista, Condachi diede inizio al servizio medico scolastico. 
380	The firm in which Hayek was CEO, split into two entities in 2006 following Hayek's departure to join the Lebanese Government under Prime Minister Siniora.	Nel 2006, dopo che Hayek si unì al governo del primo ministro libanese Siniora, l'azienda di cui era amministratorə delegatə si divise in due entità separate.
121	Cabrera is both a Catholic and a practitioner of Santería.	Cabrera è sia cattolicǝ sia praticante di Santería.
961	Tromp has spoken at the AZA festival in Pretoria and has been a judge for the PPC Imaginarium Award for Architecture.	Tromp ha tenuto un discorso all'AZA Festival di Pretoria ed è statə giudice dei PPC Imaginarium Award for Architecture.
133	The student asks sage Pippalada the same question.	Lǝ studente pone la stessa domanda allǝ saggiǝ Pippalada.
164	The Controller is a highly skilled chemist and mechanical engineer, with a college degree in chemistry and electrical and mechanical engineering.	Lə controllorə è unə chimicə altamente qualificatə ed ingegnerə meccanicə, con una laurea in chimica ed ingeneria meccanica ed elettrica. 
149	Peel was a farmer by profession, and kept a pack of fox hounds.	Peel era unə contadinə di professione, e aveva un branco di cani da caccia. 
136	The conductor's clear and methodical counting of beats is a distinct feature of this rehearsal sequence.	Il conteggio chiaro e metodico delle battute da parte dellə direttorə d'orchestra è uno dei tratti distintivi di questa sequenza delle prove. 
