ID	EN	IT
1012	Àchaval de Montaigu retired from modelling and was hired by the American fashion magazine V as a stylist, eventually becoming the editor-at-large.	Àchaval de Montaigu lasciò le passerelle e venne assuntə come stilista dalla rivista di moda americana V, di cui poi diventò lə caporedattorə.
161	The more the top player is pressuring into the top leg the tighter they lock the guard onto themselves while exerting more energy than the bottom player.	Più lə lottatorə che sta sopra preme con la gamba di richiamo, più blocca la guardia, generando maggiore energia rispetto allə lottatorə che sta sotto. 
373	Just four months later, Hutchings was sacked, and McCall was appointed as caretaker-player manager.	Solo quattro mesi dopo, Hutchings fu licenziatə, e McCall fu indicatə come assistente-giocatorə manager.
958	The first cabinet Brundtland losing office to the cabinet Willoch following the 1981 election, Strand returned to work one more year as assistant secretary in the Ministry of Finance.	In seguito alle elezioni del 1981, per cui il primo governo Brundtland dovette cedere le redini al governo Willoch, Strand tornò a lavorare per un altro anno come vicesegretariə all'Economia.
661	The physician on the first floor was eventually succeeded by two lawyers.	Lə dottorə del primo piano fu poi sostituitə da due avvocatə. 
944	Pirie was appointed Assistant Curator at the Grosvenor Museum in 1955.	Nel 1955, Pirie fu nominatə assistente curatorə del Grosvenor Museum.
836	Struth moved to Rangers in 1914 to take up the position of assistant manager.	Struth passò aǝ Rangers nel 1914 per assumere il ruolo di vice-allenatorǝ.
6	The form lends itself to plotlessness, since the author/narrator inevitably cannot see the overall structure of the story.	La forma tende a mettere in secondo piano la trama, dato  che inevitabilmente l'autorǝ/narratorǝ non è in grado di vedere l'intera struttura della storia.
845	Glidden worked as an employment and civil rights lawyer for over a decade.	Glidden ha lavorato come avvocatǝ del lavoro e dei diritti civili per oltre un decennio.
618	Durdynets is an honorary professor of the National Academy of Internal Affairs.	Durdynets è unə professorə onorariə dell'Accademia Nazionale di Affari Interni. 
557	Parsons also served as Cultural Officer from 1984-1989 and has been active in culture and sports.	Parsons fu anche funzionariə culturale dal 1984 al 1989 ed è statə attivə in ambito culturale e sportivo. 
151	Within months Rivett [CEO of CSIR] had resignations pending from almost every scientist who had come into frequent contact with Tillyard.	In qualche mese Rivett [Amministratorə Delegatə di CSIR] ricevette una lettera di dimissioni da quasi tuttə ə scienziatə che avevano avuto un contatto frequente con Tillyard. 
70	Stang is a registered dietitian through the Commission on Dietetic Registration of the American Dietetic Association.	Stang è unə dietista certificatə dalla Commission on Dietetic Registration della American Dietetic Association. 
42	Torsney was the Parliamentary Secretary to the Minister of the Environment from 1998 to 2000.	Torsney fu Segretariə Parlamentare del Ministero dell'Ambiente dal 1998 al 2000. 
1079	Kuligowski was an editor for Pedestrian and Evacuation Dynamics (Springer 2011) in addition to SFPE (Society of Fire Protection Engineers) Handbook of Fire Protection Engineering (Springer 2016).	Kuligowski fu curatorə di Pedestrian and Evacuation Dynamics (Springer, 2011) e SFPE (Society of Fire Protection Engineers) Handbook of Fire Protection Engineering (Springer, 2016)
1020	From 1989 to 1995 Widder was scientific assistant at the University of Münster.	Dal 1989 al 1995, Widder fu assistente scientificə presso l'Università di Münster.
391	The mysterious and ominous nature of the musician, along with the question posed in the last lines, leave the fate of the wanderer open to interpretation.	La misteriosa e sinistra natura dellə musicistə, insieme al quesito posto nelle ultime strofe, lasciano il destino dellə viandante aperto a qualsiasi interpretazione. 
24	Willetts is the author of several books on conservatism, including Why Vote Conservative (1996) and Modern Conservatism (1992), as well as numerous articles.	Willetts è l'autorǝ di diversi libri sul conservatorismo, tra cui "Why Vote Conservative" (1996) e "Modern conservatism" (1992), oltre a numerosi articoli.
811	Eldem was among the founders of the monthly music and counter-culture magazine Studyo Imge (now considered as a cult) and became its first editor in early 1985.	Eldem era tra ǝ fondatorǝ del magazine di controcultura e musica Stufyo Imge (ora considerato un cult) e divenne lǝ suǝ primǝ redattorǝ all'inizio del 1985.
1004	Daneh was a doctor before The Fall, specializing in (genetic) Change-related complications.	Daneh era unə medicə prima della Caduta, ed era specializzatə in complicazioni genetiche collegate al Cambiamento.
875	Nahón was a professor at the National University of Quilmes and a CONICET scholar.	Nahón era unǝ professorǝ dell'Università Nazionale di Quilmes e unǝ studiosǝ del CONICET.
282	The cost of one $40 shirt funds an entire school year for a student.	Il costo di una maglietta, 40 dollari, finanzia unə studente per un intero anno scolastico.
289	Both were published in deluxe editions bound in a flowered chintz of scattered pansies the author selected.	Entrambi furono pubblicati in un'edizione deluxe e rilegati in cinz con un motivo di margherite scelto personalmente dall'autorə.
134	This botanist is denoted by the author abbreviation Wedd.	Questǝ botanicǝ è denotatǝ dall'abbreviazione Wedd dell'autorǝ.
60	The librarian resigned out of principle after an unsuccessful attempt to resolve the issue with administration.	Lə bibliotecariə si dimise per principio, non essendo riuscitə a risolvere il problema con l'amministrazione. 
622	The report of the surgeon described the wound as a deep cut on the parietal bone, extending from the top of the head ... towards the left ear, [the bone] penetrated for at least three inches in length.	Il rapporto dellə chirurgə descriveva la ferita come un taglio profondo sull'osso parietale, esteso dalla cima della testa ... verso l'orecchio sinistro, [l'osso] era penetrato di almeno tre pollici di lunghezza. 
607	From 1945 until 1973 professor of the Polish University in Exile.	Dal 1945 al 1973 professorə della Polish University ad Exile. 
381	Tambling also briefly served as manager of Cork City during the 1984–85 season.	Tambling fu anche l'allenatorə del Cork City per un breve periodo durante la stagione 1984-85.
100	For a brief period in the early 1970s, Ahern worked as a secondary school teacher.	Per un breve periodo all'inizio degli anni '70, Ahern lavorò come insegnante scolasticǝ secondariǝ.
341	Heenan still found time to work as a locomotive engineer when the House was not in session.	Heenan comunque trovò tempo per lavorare come ingegnerə di locomotiva quando la Camera non era in sessione.
928	Rabe became the editor of a BattleTech magazine, MechForce Quarterly, in 1995.	Nel 1995 Rabe divenne editorə di MechForce Quarterly, una rivista di BattleTech.
962	With medicine strong in the family, it was natural for Hogg to become a doctor.	Dato che la medicina era una cosa di famiglia, fu naturale per Hogg diventare (unǝ) dottorǝ.
441	Beadle's chief hobbies were rockclimbing, skiing, and gardening.	Gli hobby dellə capə Beadle erano scalata, sci e giardinaggio. 
1068	From 1981 to 1983, Kovac was employed as a chemist working on carbon-based materials.	Dal 1981 al 1983, Kovac lavorò come come chimicə su materiali a base di carbonio.
242	Ivins later became co-editor of the arts and culture section of the student paper.	Ivins diventò poi co-redattorə della sezione dedicata all'arte e alla cultura del giornalino scolastico.
474	Haldorsen was medical superintendent of a children's home and advisor to a hospital board from 1959 to about 1964.	Dal 1959 al 1964 circa, Haldorsen fu sovrintendente medicə di un orfanotrofio e consulente di un consiglio ospedaliero.
543	The Prison Officer was also convicted of smuggling three mobile phones into HMYOI Aylesbury.	L’ufficiale penitenziariə fu anche accusatə di aver trafugato tre telefoni cellulari nel carcere minorile di Aylesbury. 
835	Bodwell served as clerk and treasurer for the township, later becoming a member of the township council, then reeve and later warden for Oxford County.	Bodwell ha lavorato come impiegatǝ e tesorierǝ per il comune, e successivamente diventò membro del consiglio comunale, e in seguito dipendente pubblicǝ e poi guardiana per la contea di Oxford.
1024	Dromgoole was a prolific writer, publishing both prose and poetry.	Dromgoole fu unə scrittorə prolificə che pubblicò sia prosa che poesia.
802	Gipper was also influential as co-editor of an extensive bibliography on Sprachinhaltsforschung, as linguistics broadly within the Weisgerber tradition has come to be known.	Gipper fu anche influente come coredattorǝ di una bibliografia estensiva su Sprachinhaltsforschung, in quanto la linguistica all'interno della tradizione Weisgerber era diventata conosciuta.
65	A voice teacher, however, would never classify a singer in more than one voice type, regardless of the size of the vocal range of the singer.	Unə insegnante di canto, tuttavia, non assegnerebbe mai a unə cantante più di una classificazione vocale, a prescindere dalla sua estensione. 
839	The distinctive manner of characterization through realistic dialogues is seen by Vianu as a highly personal intervention and indicator of the Moldavian writer's originality.	La distintiva caratterizzazione, operata attraverso dialoghi realistici, è vista da Vianu come un intervento altamente personale, indicativo dell'originalità dellǝ scrittorǝ moldavǝ.
450	At Olde Sküül, Heineman acts as CEO.	Alla Olde Sküül, Heineman funge da amministratorə delegatə. 
856	Sutcliffe is an internationally recognised wine writer and renowned taster and writes regularly for many international publications.	Sutcliffe è unǝ autorǝ enogastronomicǝ riconosciutǝ a livello internazionale nonché unǝ rinomatǝ degustatorǝ, e scrive regolarmente per numerose pubblicazioni internazionali.
467	A futuristic building, faithful to the imprint of the architect, which should host the biggest cultural events of the Moroccan capital.	Un edificio futuristico, fedele all'impronta dell'architettə, che dovrebbe ospitare i maggiori eventi culturali previsti nella capitale marocchina.
941	Tittel is a lawyer by profession.	Tittel è unə avvocatə di professione.
732	As a professor, Beccker supervises doctoral students in entomology (e.g.	Come professorǝ, Beccker supervisiona ǝ studenti dottorandǝ in entomologia.
194	LaFlesche served as principal chief until 1888.	LaFlesche lavorò come capə principale fino al 1888. 
729	Despite these opportunities in athletics and commercial art, Bellows desired success as a painter.	Nonostante queste opportunità in atletica ed arte commerciale, Bellows desiderava avere successo come pittorǝ.
139	As of 2019, Ramsfjell was a masters student in electrical engineering.	Dal 2019, Ramsfjell è unǝ studente del master in ingegneria elettrica.
1064	Later, Conkwright worked as the director of Weider Athlete Promotions and managed Weider contracted athletes.	Successivamente, Conkwright lavorò come direttorə di Weider Athlete Promotions e gestì ə atletə sotto contratto con Weider.
479	Montes advanced rapidly through the ranks at the DIA and became its most senior Cuban analyst.	Montes scalò rapidamente i ranghi della DIA e divenne l'analista cubanə più anzianə dell'agenzia.
196	Shiplee is a former director of specialist construction consultancy High Point Rendel.	Shiplee è l'ex direttorə dell'agenzia di consulenza High Point Rendel, che opera nel settore delle costruzioni. 
61	Seeking a career outside of a traditional office environment, Malarkey returned to Pennsylvania to apprentice as a tattoo artist.	Desiderosə di intraprendere una carriera diversa dal tipico lavoro d'ufficio, Malarkey tornò in Pennsylvania per fare l'apprendista tatuatorə. 
766	Wrenfordsley later joined the colonial service and was appointed as a puisne judge at Mauritius in 1877.	Wrenfordsley si unì poi al servizio coloniale e nel 1877 fu nominatǝ giudice puisne alle Mauritius.
118	Cook was pressed into service as a player as a result of injuries.	Cook fu costrettǝ a prestare servizio come giocatorǝ in seguito agli infortuni.
165	Kahane is the author of Passions of the Voice, a study of narrative and the strategies of hysteric discourse.	Kahane è l'autorǝ di Passions of the Voice, uno studio di narrativa e strategie di discorso isterico.
746	Spreckman's Boat (also 1996) was an ensemble piece which featured Futterman as a smarmy doctor in an interracial relationship.	Spreckman's Boat, sempre del 1996, era un'opera d'ensemble in cui Futterman interpretava unǝ viscidǝ dottorǝ in una relazione interrazziale.
1062	A painter in the neoclassical style, Lemper's paintings have been showcased in numerous galleries.	Pittorə di stile neoclassico, i lavori di Lemper sono stati esposti in moltissime gallerie.
3	At the 1917 National Convention of the Socialist Party, Spargo was the author of a minority resolution in the Committee on War and Militarism calling for American support of the Allied war effort as the least onerous alternative facing the socialist movement.	Al convegno nazionale del partito socialista del 1917, Spargo fu l'autorə di una risoluzione minoritaria nella commisione sulla guerra e il militarismo, definendo il supporto americano per lo sforzo bellico congiunto come l'alternativa meno onerosa che fronteggiava il movimento socialista. 
278	Shinebourne is the author of novels, short stories, and essays.	Shinebourne è autorə di romanzi, racconti brevi e saggi.
863	Peck, Class of 1906 Professor in the School of Engineering.	Peck, professorǝ della School of Engineering nella classe del 1906.
629	While questioning a witness, the magistrate would look closely for five kinds of behavior: the person's statements, expression, breathing, reaction to the words of the judge, and eyes.	Quando interrogava unə testimone, lə magistratə prestava particolare attenzione a cinque aspetti del suo comportamento: ciò che diceva, la sua espressione, il suo respiro, le sue reazioni a ciò che diceva lə giudice e il suo sguardo. 
67	Writing for this author is a mission.	Per questə autorə, la scrittura è una missione. 
1014	MacDonald also served as an editor and writer at Publishers Weekly.	MacDonald è statə anche redattorə e articolista per Publishers Weekly.
645	Reisinger initially lived in a transit camp and then worked as a house painter in order to earn money from almost any source.	Inizialmente Reisinger visse in un campo di transito per poi lavorare come pittorə per guadagnare qualche soldo in qualunque modo possibile. 
297	Haslam was a teacher and librarian before entering public life.	Haslam fu professorə e bibliotecariə prima di entrare nella vita pubblica.
843	The Professor reads a passage from a historical book, which activates the time machine, a literary device.	Lǝ Professorǝ legge un brano da un libro di storia, attivando la macchina del tempo, un espediente letterario.
726	Lehane served as a writer for the fifth and final season in 2008 and was credited with the episode Clarifications.	Lehane lavorò come scrittorə per la quinta e ultima stagione nel 2008 e fu accreditatə con l'episodio Clarifications.
228	McSherry is also recognized as a teacher.	McSherry è anche rinomatə come insegnante.
259	A dancer from age four, Cook began taking jazz, tap and ballet lessons.	Ballerinə da quando aveva quattro anni, Cook iniziò a prendere lezioni di jazz, tip-tap e balletto.
628	The 1980s established Scruton as a prolific writer.	Negli anni '80, Scruton si confermò essere unə scrittorə prolificə. 
248	I hope our nurse will be nice to our friend now.	Spero che ora lə nostrə infermierə sia più gentile con lə nostrə amicə.
844	These novels established Bristow as a popular writer of historical fiction.	Questi romanzi hanno conferito a Bristow grande popolarità come autorǝ di narrativa storica.
41	Salonga is the first Filipino artist to sign with an international record label (Atlantic Records in 1993).	Salonga è lə primə artista filippinə a firmare con una casa discografica internazionale (la Atlantic Records nel 1993). 
35	Prior to running for political office, Oleson raised three children and worked as librarian for the town of Glenboro and later for Glenboro Collegiate.	Prima di entrare in politica, Oleson ha cresciuto tre figliə e ha lavorato come bibliotecariə prima per il municipio di Glenboro e poi per il liceo della medesima città. 
362	Trapp also proved to be an effective law enforcement officer.	Trapp provò anche ad essere unə agente delle forze dell'ordine effettivə.
55	The child and the nurse survived.	Lə bambinə e l'infermierə sopravvissero. 
316	Furthermore, Bandem is also a culture engineer.	Inoltre, Bandem è anche unə ingegnerə della cultura.
142	The extensive press coverage of the incident made Monteux at age thirty-eight, truly a famous conductor.	L'ampia copertura mediatica dell'incidente portò Monteux alla ribalta, a soli 38 anni, come acclamatə direttorə d'orchestra. 
763	Professor Bojic has rich research experience in various fields including energy recovery, thermal comfort, finite-time thermodynamics, Integration, thermo economy, Global warming, air conditioning engineering, etc.	Lǝ professorǝ Bojic ha una grande esperienza di ricerca in diversi ambiti inclusi il recupero d'energia, comfort termico, termodinamica a tempo finito, integrazioni, termo economia, riscaldamento globale, ingegneria dell'aria condizionata, eccetera.
97	Again it left the literary critics divided: social democrats praised its stark honesty, many others were appalled with the author's negativism.	Lasciò di nuovo ǝ criticǝ letterariǝ divisǝ: ǝ socialdemocraticǝ apprezzarono la sua cruda onestà, moltǝ altrǝ furono sconvoltǝ dal negativismo dell'autorǝ.
146	While working full-time as an author, Busch continued to write articles and monthly columns for magazines such HomePC, Macworld, Internet World, NetGuide, Windows Magazine, Windows Sources, and many other publications.	Mentre lavorava a tempo pieno come scrittorǝ, Busch continuò a scrivere articoli ed editoriali mensili per riviste come HomePC, Macworld, Internet World, NetGuide, Windows Magazine, Windows Sources e molte altre pubblicazioni.
689	The song itself is about an oriental baker of fortune cookies.	La stessa canzone tratta di unə fornaiə orientale di biscotti della fortuna.
241	Cook first appeared in a public service announcement for foster care at seven years of age, and began working as a child print model at the age of 10, most notably in nationwide advertisements for Target and appearing on the boxes of Milk-Bone dog biscuits.	Cook è apparsə per la prima volta in un annuncio di servizio pubblico per l'affidamento all'età di sette anni, e cominciò a lavorare come bambinə modellə per la stampa a 10 anni, in particolare per annunci nazionali per Target e apparendo sui cartoni dei biscotti per cani Milk-Bone.
150	Hunk is a mechanic and Voltron Force member.	Hunk è unə meccanicə e membro della Voltron Force. 
1052	Ro has enjoyed an extensive career as an athlete and as a professional trainer.	Ro ha avuto una longeva carriera come atleta e allenatorə professionista.
314	They voted Skanderbeg as their suzerain chief.	Votarono Skanderbeg come loro capə suzerianə.
276	Teach First had a 92% retention rate of recruits in 2012, with the recruit earning a good teacher label by observers.	Nel 2012 lə modellə Teach First contava un tasso di retention del 92%, e ə neo-assuntə ricevevano un giudizio positivo daə osservatorə.
413	Which would indicate that Baasha was a soldier or officer in Nadab's army.	Il che suggerirebbe che Baasha fosse unə soldatə o unə ufficiale nell'esercito di Nadab. 
1019	A gifted and varied writer, Pardoe published many books on varied subjects that strayed across genres and often had an international perspective.	Scrittorə di talento e variegatə, Pardoe pubblicò molti libri su vari argomenti di diverso genere che spesso avevano una prospettiva internazionale.
857	During the voyages Hayter provided anti-submarine protection and transferred the division doctor to many merchant ships in the convoy needing medical assistance.	Durante i viaggi, Hayter forniva protezione anti-sottomarino e trasportava lǝ dottorǝ di divisione tra le varie navi mercantili del convoglio in caso di emergenze mediche.
92	A company secretary routinely enters into contracts in the company's name and has administrative responsibilities that would give apparent authority to hire cars.	Lǝ segretariǝ di una società subentra nei contratti a nome della società ed ha responsabilità amministrative che lǝ garantiscono una rappresentanza apparente per noleggiare auto.
838	Gdowski served as their assistant head coach and offensive coordinator for 2003 and 2004.	Gdowski ha lavorato come assistente capǝ allenatorǝ e coordinatorǝ dell'offensiva dal 2003 al 2004.
205	The scullery maid reported (through the kitchen maid) to the cook or chef.	Lǝ sguatterǝ, per mezzo dellǝ domesticǝ, rispondeva allǝ cuocǝ o allǝ chef.
236	The nurse drives through a rainy night, meeting a military tank on the road that is apparently hunting foxes.	L'infermierə guida nella notte piovosa, imbattendosi in un carrarmato che sembra essere a caccia di volpi.
353	With the way I am though, both for Juventus and for the national team I have always considered myself a soldier, so I could never desert a possible call in the future if needed.	Però, per come sono fattə, mi sono sempre consideratə una soldatə a disposizione della Juventus come della Nazionale, quindi se mai ci fosse bisogno di me in futuro non mi sottrarrei di certo.
279	These books, set primarily in the Austrian countryside, display the author's love of nature.	Questi libri, ambientati principalmente nelle campagne austriache, mostrano il grande amore dell'autorə per la natura.
344	The test opened new doors for the Brazilian driver, and 2006 was a promising year.	Il test apriva le porte per l'autista brasilianə, e il 2006 fu un anno promettente.
64	Poirier is a teacher at the Université du Québec en Outaouais, and is a former vice-president of the New Democratic Party in the riding.	Poirier è unə docente alla Université du Québec en Outaouais, ed è statə vice-presidente del New Democratic Party. 
190	This success has made Rowling the first and thus far only billionaire author.	Questo successo ha reso Rowling lǝ primǝ, e finora l'unicǝ, autorǝ miliardariǝ. 
737	Slowinski was a founder of the first online herpetological journal, Contemporary Herpetology, and served as its editor-in-chief.	Slowinski fu unǝ fondatorǝ del primo giornale erpetologico online, Contemporary Herpetology, ed ha lavorato come suǝ caporedattorǝ.
613	Hevia, who was also a surgeon, had been the first Cuban national to graduate from the United States Naval Academy at Annapolis, as a member of the Class of 1920.	Hevia, che è anche chirurgə, fu lə primə cubanə a diplomarsi nell'Accademia Navale degli Stati Uniti ad Annapolis, come membro della classe del 1920. 
46	Levavasseur is a trained nurse's aide.	Levavasseur ha studiato come aiuto infermierə. 
197	Wasilewska joined the PPS as a student.	Wasilewska si è iscrittǝ al PPS quand'era ancora unǝ studente.
530	Hsieh was subsequently assigned to Jingmei Precinct first as deputy chief, and later first division chief.	Hsieh fu dunque assegnatə al distretto di Jingmei prima come vice capə e poi come capə della prima divisione. 
621	Dunning gained a national reputation as a lawyer, and was committed to criminal law.	Dunning ha conquistato una reputazione nazionale come avvocatə, ed il suo focus era diritto penale. 
13	Professionally, Zündel worked as a graphic artist, photographer, photo retoucher, and printer.	Professionalmente, Zündel ha lavorato come artista graficǝ, fotografǝ, ritoccatorǝ di foto e tipografǝ.
119	Otaki is the head inspector of the Osaka district, and good friends with Heizo Hattori and Ginshiro Toyama.	Otaki è ispettorə capə del distretto di Osaka e grande amicə di Heizo Hattori e Ginshiro Toyama. 
586	Johansson became Creative Advisor in 2015, and has subsequently worked as H&M's spokesperson and representative.	Johansson è diventato consulente creativə nel 2015, e ha poi lavorato come portavoce e rappresentante di H&M.
748	From 1832 to 1849, Steinheil was professor for mathematics and physics at the University of Munich.	Dal 1832 al 1849, Steinheil fu professorǝ di matematica e fisica presso l'università di Monaco.
523	Serving as an officer of the provincial legislature, the Commissioner is independent of the government of the day.	In qualità di ufficiale della legislatura provinciale, lə Commissariə è indipendente da qualsiasi governo sia in carica. 
63	Delehanty was a prolific designer of bookplates.	Delehanty fu unə prolificə disegnatorə di targhette. 
704	Frankland wished to become a doctor, but the cost of training was absolutely prohibitive.	Frankland voleva diventare unə dottorə, ma il costo per la formazione era assolutamente proibitivo. 
